aa,kepCode,kepTitle,area,county,region,address,tk,phoneNumber,fax,email,comments
216,223,ΚΕΠ ΔΗΜΟΥ ΔΙΑΚΟΠΤΟΥ Ν. ΑΧΑΪΑΣ,Διακοπτό Αχαϊας,ΝΟΜΟΣ ΑΧΑΪΑΣ,ΔΥΤΙΚΗΣ ΕΛΛΑΔΑΣ,Διακοπτό Αχαϊας,25003,2691043705,2691043706,d.diakoptou@kep.gov.gr,
217,224,"ΚΕΠ ΔΗΜΟΥ ΑΛΙΑΡΤΟΥ, Ν ΒΟΙΩΤΙΑΣ",Αλίαρτος Βοιωτίας,ΝΟΜΟΣ ΒΟΙΩΤΙΑΣ,ΣΤΕΡΕΑΣ ΕΛΛΑΔΑΣ,Κεντρική Πλατεία Αλιάρτου,32001,2268029300,2268029300,d.aliartou@kep.gov.gr,
218,225,"ΚΕΠ ΔΗΜΟΥ ΤΥΧΕΡΟΥ, Ν ΕΒΡΟΥ",Τυχερό,ΝΟΜΑΡΧΙΑΚΟ ΔΙΑΜΕΡΙΣΜΑ ΕΒΡΟΥ,ΑΝΑΤΟΛΙΚΗΣ ΜΑΚΕΔΟΝΙΑΣ ΚΑΙ ΘΡΑΚΗΣ,Τυχερό,68003,2554020104,-,d.tyherou@kep.gov.gr,
219,226,"ΚΕΠ ΔΗΜΟΥ ΕΛΑΤΙΩΝ, Ν ΖΑΚΥΝΘΟΥ",Ελατίων,ΝΟΜΟΣ ΖΑΚΥΝΘΟΥ,ΙΟΝΙΩΝ ΝΗΣΩΝ,Βολίμες,29091,2695032000,2695032002,d.elation@kep.gov.gr,
220,227,ΚΕΠ ΔΗΜΟΥ ΓΟΡΓΟΛΑΙΝΗ Ν. ΗΡΑΚΛΕΙΟΥ,Άγιος Μύρων Ηρακλείου,ΝΟΜΟΣ ΗΡΑΚΛΕΙΟΥ,ΚΡΗΤΗΣ,"Άγιος Μύρωνας, Ηρακλείου",70013,2810721433,2810721313,d.gorgolainis@kep.gov.gr,
221,228,ΚΕΠ ΔΗΜΟΥ ΑΡΧΑΝΩΝ Ν. ΗΡΑΚΛΕΙΟΥ,"Ηράκλειο, Κρήτη",ΝΟΜΟΣ ΗΡΑΚΛΕΙΟΥ,ΚΡΗΤΗΣ,Άνω Αρχάνες,70100,2810752960,2810752956,d.arhanon@kep.gov.gr,
222,229,"ΚΕΠ ΔΗΜΟΥ ΣΑΓΙΑΔΑΣ, Ν ΘΕΣΠΡΩΤΙΑΣ",-,ΝΟΜΟΣ ΘΕΣΠΡΩΤΙΑΣ,ΗΠΕΙΡΟΥ,Ασπροκλήσι,46300,2664051922,2664051923,d.sagiadas@kep.gov.gr,
223,230,ΚΕΠ ΔΗΜΟΥ ΠΑΡΑΜΥΘΙΑΣ Ν. ΘΕΣΠΡΩΤΙΑΣ,Παραμυθιά Θεσπρωτίας,ΝΟΜΟΣ ΘΕΣΠΡΩΤΙΑΣ,ΗΠΕΙΡΟΥ,Κωνσταντίνου Καραμανλή 173,,2666029031,2666029030,d.paramythias@kep.gov.gr,
224,231,"ΚΕΠ ΔΗΜΟΥ ΕΛΕΥΘΕΡΙΟΥ-ΚΟΡΔΕΛΙΟΥ, Ν ΘΕΣΣΑΛΟΝΙΚΗΣ",Θεσσαλονίκη,ΝΟΜΟΣ ΘΕΣΣΑΛΟΝΙΚΗΣ,ΚΕΝΤΡΙΚΗΣ ΜΑΚΕΔΟΝΙΑΣ,Εθνικής Αντιστάσεως 42,56334,2310703546,2310703549,d.elefkordeliou@kep.gov.gr,
225,232,"ΚΕΠ ΔΗΜΟΥ ΚΟΥΦΑΛΙΩΝ, Ν ΘΕΣΣΑΛΟΝΙΚΗΣ",Κουφάλια Θεσσαλονίκης,ΝΟΜΟΣ ΘΕΣΣΑΛΟΝΙΚΗΣ,ΚΕΝΤΡΙΚΗΣ ΜΑΚΕΔΟΝΙΑΣ,Τέρμα Εθνικής Αντίστασης,57100,2391021250,2391021238,d.koyfalion@kep.gov.gr,
226,233,"ΚΕΠ ΔΗΜΟΥ ΜΕΝΕΜΕΝΗΣ, Ν ΘΕΣΣΑΛΟΝΙΚΗΣ",Θεσσαλονίκη,ΝΟΜΟΣ ΘΕΣΣΑΛΟΝΙΚΗΣ,ΚΕΝΤΡΙΚΗΣ ΜΑΚΕΔΟΝΙΑΣ,Ν.Κυριακίδη 24 & Μ. Αιμιλιανού 24,56122,2313306600,2313306620,d.menemenis@kep.gov.gr,
227,234,"ΚΕΠ ΔΗΜΟΥ ΝΕΑΠΟΛΗΣ, Ν ΘΕΣΣΑΛΟΝΙΚΗΣ",Νεάπολη Θεσσαλονίκης,ΝΟΜΟΣ ΘΕΣΣΑΛΟΝΙΚΗΣ,ΚΕΝΤΡΙΚΗΣ ΜΑΚΕΔΟΝΙΑΣ,Ελευθερίου Βενιζέλου 125,56728,2310672511,2310672840,d.neapoleos@kep.gov.gr,
228,235,ΚΕΠ ΔΗΜΟΥ ΠΟΛΙΧΝΗΣ Ν. ΘΕΣΣΑΛΟΝΙΚΗΣ,ΠΟΛΙΧΝΗ,ΝΟΜΟΣ ΘΕΣΣΑΛΟΝΙΚΗΣ,ΚΕΝΤΡΙΚΗΣ ΜΑΚΕΔΟΝΙΑΣ,Θ.ΚΑΡΥΠΙΔΗ 9,56533,2310609851,2310587287,d.polihnis@kep.gov.gr,
229,236,ΚΕΠ ΝΟΜΑΡΧΙΑΚΗΣ ΑΥΤΟΔΙΟΙΚΗΣΗΣ ΘΕΣΣΑΛΟΝΙΚΗΣ,Θεσσαλονίκη,ΝΟΜΟΣ ΘΕΣΣΑΛΟΝΙΚΗΣ,ΚΕΝΤΡΙΚΗΣ ΜΑΚΕΔΟΝΙΑΣ,Δελφών 195,54655,2310403240,2310412135,n.thessalonikis@kep.gov.gr,
230,237,"ΚΕΠ ΔΗΜΟΥ ΔΕΛΒΙΝΑΚΙΟΥ, Ν ΙΩΑΝΝΙΝΩΝ",Δελβινάκι Ιωάννινα,ΝΟΜΟΣ ΙΩΑΝΝΙΝΩΝ,ΗΠΕΙΡΟΥ,Δελβινάκι,44002,2657022051,2657022031,d.delvinakiou@kep.gov.gr,
231,238,"ΚΕΠ ΔΗΜΟΥ ΔΩΔΩΝΗΣ, Ν ΙΩΑΝΝΙΝΩΝ",Μάνδρες Ιωαννίνων,ΝΟΜΟΣ ΙΩΑΝΝΙΝΩΝ,ΗΠΕΙΡΟΥ,Μάνδρες,45500,2651082084,2651082493,d.dodonis@kep.gov.gr,
232,239,"ΚΕΠ ΔΗΜΟΥ ΜΟΛΟΣΣΩΝ, Ν ΙΩΑΝΝΙΝΩΝ",Βουτσαράς Ιωαννίνων,ΝΟΜΟΣ ΙΩΑΝΝΙΝΩΝ,ΗΠΕΙΡΟΥ,Βουτσαράς Ιωαννίνων,44003,2658031130,2658031131,d.molosson@kep.gov.gr,
233,240,"ΚΕΠ ΔΗΜΟΥ ΠΑΜΒΩΤΙΔΟΣ, Ν ΙΩΑΝΝΙΝΩΝ",ΚΑΤΣΙΚΑΣ ΙΩΑΝΝΙΝΩΝ,ΝΟΜΟΣ ΙΩΑΝΝΙΝΩΝ,ΗΠΕΙΡΟΥ,ΖΩΣΙΜΑΔΩΝ & ΜΑΒΙΛΗ ΚΕΝΤΡΙΚΗ ΠΛΑΤΕΙΑ ΚΑΤΣΙΚΑΣ ΙΩΑΝΝΙΝΩΝ -,45500,2651092279,2651094721,d.pamvotidos@kep.gov.gr,
234,241,"ΚΕΠ ΔΗΜΟΥ ΚΑΣΣΩΠΑΙΩΝ, Ν ΚΕΡΚΥΡΑΣ",Κέρκυρα,ΝΟΜΟΣ ΚΕΡΚΥΡΑΣ,ΙΟΝΙΩΝ ΝΗΣΩΝ,Γιμάρι Κέρκυρας,49083,2663091771,2663091781,d.kassopaion@kep.gov.gr,
235,242,ΚΕΠ ΔΗΜΟΥ ΜΕΛΙΤΕΙΕΩΝ Ν. ΚΕΡΚΥΡΑΣ,"Ανω Μεσόγγη, Κέρκυρα",ΝΟΜΟΣ ΚΕΡΚΥΡΑΣ,ΙΟΝΙΩΝ ΝΗΣΩΝ,"Ανω Μεσόγγη, Κέρκυρα",49084,2661080298,2661080289,d.meliteieon@kep.gov.gr,
236,243,"ΚΕΠ ΔΗΜΟΥ ΠΑΞΩΝ, Ν ΚΕΡΚΥΡΑΣ",Παξοί Κερκύρας,ΝΟΜΟΣ ΚΕΡΚΥΡΑΣ,ΙΟΝΙΩΝ ΝΗΣΩΝ,Γάϊος Παξοί,49082,2662032166,2662032466,d.paxon@kep.gov.gr,
237,244,"ΚΕΠ ΔΗΜΟΥ ΙΘΑΚΗΣ, Ν ΚΕΦΑΛΛΗΝΙΑΣ",-,ΝΟΜΟΣ ΚΕΦΑΛΛΗΝΙΑΣ ΚΑΙ ΙΘΑΚΗΣ,ΙΟΝΙΩΝ ΝΗΣΩΝ,Γ. ΔΡΑΚΟΥΛΗ Βαθύ Ιθάκης,28300,2674032110,2674032112,d.ithakis@kep.gov.gr,
238,245,ΚΕΠ ΔΗΜΟΥ ΑΜΠΕΛΩΝΑ Ν. ΛΑΡΙΣΑΣ,ΑΜΠΕΛΩΝΑ,ΝΟΜΟΣ ΛΑΡΙΣΗΣ,ΘΕΣΣΑΛΙΑΣ,ΓΡΗΓΟΡΙΟΥ ΛΑΜΠΡΑΚΗ 14,40400,2492032972,2492032953,d.ampelona@kep.gov.gr,
239,246,"ΚΕΠ ΔΗΜΟΥ ΜΑΚΡΥΧΩΡΙΟΥ, Ν ΛΑΡΙΣΑΣ",Μακρυχώρι,ΝΟΜΟΣ ΛΑΡΙΣΗΣ,ΘΕΣΣΑΛΙΑΣ,Μακρυχώρι,40006,2495023911,2495023910,d.makryhoriou@kep.gov.gr,
240,247,ΚΕΠ ΔΗΜΟΥ ΜΕΛΙΒΟΙΑΣ Ν. ΛΑΡΙΣΑΣ,Παραλία Βέλικας,ΝΟΜΟΣ ΛΑΡΙΣΗΣ,ΘΕΣΣΑΛΙΑΣ,Παραλία Βέλικας,40003,2494051604,2494051606,d.melivoias@kep.gov.gr,
241,248,ΚΕΠ ΔΗΜΟΥ ΠΟΛΥΔΑΜΑΝΤΑ Ν. ΛΑΡΙΣΑΣ,Βαμβακού Λάρισας,ΝΟΜΟΣ ΛΑΡΙΣΗΣ,ΘΕΣΣΑΛΙΑΣ,Βαμβακού,40300,2491041777,2491028089,d.polydamanta@kep.gov.gr,
242,249,"ΚΕΠ ΔΗΜΟΥ ΣΗΤΕΙΑΣ, Ν ΛΑΣΙΘΙΟΥ",Σητεία,ΝΟΜΟΣ ΛΑΣΙΘΙΟΥ,ΚΡΗΤΗΣ,Μεγάλου Αλεξάνδρου 1,72300,2843029820,2843029053,d.siteias@kep.gov.gr,
243,250,"ΚΕΠ ΔΗΜΟΥ ΑΛΜΥΡΟΥ, Ν ΜΑΓΝΗΣΙΑΣ",Μαγνησία,ΝΟΜΟΣ ΜΑΓΝΗΣΙΑΣ,ΘΕΣΣΑΛΙΑΣ,Βασ. Κωνσταντίνου - Ιάσωνος 117,37100,2422350100 2422350114 2422350116 2422350117 2422350119,2422350115,d.almyrou@kep.gov.gr,
244,251,"ΚΕΠ ΔΗΜΟΥ ΠΕΤΑΛΙΔΙΟΥ, Ν ΜΕΣΣΗΝΙΑΣ",ΠΕΤΑΛΙΔΙ,ΝΟΜΟΣ ΜΕΣΣΗΝΙΑΣ,ΠΕΛΟΠΟΝΝΗΣΟΥ,ΠΕΤΑΛΙΔΙ,24005,2722029504,2722029522,d.petalidiou@kep.gov.gr,
245,252,"ΚΕΠ ΔΗΜΟΥ ΝΙΚΑΙΑΣ, Ν ΠΕΙΡΑΙΩΣ",ΝΙΚΑΙΑ ΠΕΙΡΑΙΑ,ΝΟΜΑΡΧΙΑΚΟ ΔΙΑΜΕΡΙΣΜΑ ΠΕΙΡΑΙΩΣ,ΑΤΤΙΚΗΣ,ΜΑΙΝΕΜΕΝΗΣ 57-59,18453,2104257130 2104257131 2104257132 2104257133 2104257134,2104257135,d.nikaias-peiraios@kep.gov.gr,
246,253,ΚΕΠ ΔΗΜΟΥ ΚΑΤΕΡΙΝΗΣ Ν. ΠΙΕΡΙΑΣ,ΚΑΤΕΡΙΝΗ,ΝΟΜΟΣ ΠΙΕΡΙΑΣ,ΚΕΝΤΡΙΚΗΣ ΜΑΚΕΔΟΝΙΑΣ,ΠΛΑΤΕΙΑ ΔΗΜΑΡΧΕΙΟΥ -,60100,2351350000 2351350001 2351350002 2351350003 2351350004 2351350005 2351350006,2351350020,d.katerinis@kep.gov.gr,
247,254,"ΚΕΠ ΔΗΜΟΥ ΡΟΔΟΛΙΒΟΥΣ, Ν ΣΕΡΡΩΝ",Ροδόλιβος Σερρών,ΝΟΜΟΣ ΣΕΡΡΩΝ,ΚΕΝΤΡΙΚΗΣ ΜΑΚΕΔΟΝΙΑΣ,Μεγάλου Αλεξάνδρου 35,62041,2324020728,2324020739,d.rodolivous@kep.gov.gr,
248,255,"ΚΕΠ ΔΗΜΟΥ ΕΣΤΙΑΙΩΤΙΔΑΣ, Ν ΤΡΙΚΑΛΩΝ",ΜΕΓΑΛΟΧΩΡΙ ΕΣΤΙΑΙΩΤΙΔΑΣ,ΝΟΜΟΣ ΤΡΙΚΑΛΩΝ,ΘΕΣΣΑΛΙΑΣ,ΜΕΓΑΛΟΧΩΡΙ ΕΣΤΙΑΙΩΤΙΔΑΣ,42100,2431056425,2431056428,d.estiaiotidas@kep.gov.gr,
249,256,"ΚΕΠ ΔΗΜΟΥ ΓΟΜΦΩΝ, Ν ΤΡΙΚΑΛΩΝ",Τρίκαλα,ΝΟΜΟΣ ΤΡΙΚΑΛΩΝ,ΘΕΣΣΑΛΙΑΣ,Λυγαριά,42100,2431062012,2431062047,d.gomfon@kep.gov.gr,
250,257,"ΚΕΠ ΔΗΜΟΥ ΜΕΓΑΛΩΝ ΚΑΛΥΒΙΩΝ, Ν ΤΡΙΚΑΛΩΝ",ΜΕΓΑΛΑ ΚΑΛΥΒΙΑ - ΤΡΙΚΑΛΑ,ΝΟΜΟΣ ΤΡΙΚΑΛΩΝ,ΘΕΣΣΑΛΙΑΣ,ΜΕΓΑΛΑ ΚΑΛΥΒΙΑ - ΤΡΙΚΑΛΑ -,42030,2431352021 2431352022 2431352023,2431352024,d.megkalyvion@kep.gov.gr,
251,258,"ΚΕΠ ΔΗΜΟΥ ΠΥΛΗΣ, Ν ΤΡΙΚΑΛΩΝ",Πύλη Τρικάλων,ΝΟΜΟΣ ΤΡΙΚΑΛΩΝ,ΘΕΣΣΑΛΙΑΣ,Ηρώων 1940,42032,2434029070,2434029071,d.pylis@kep.gov.gr,
252,259,ΚΕΠ ΔΗΜΟΥ ΑΕΤΟΥ Ν. ΦΛΩΡΙΝΑΣ,ΑΕΤΟΣ ΦΛΩΡΙΝΑΣ,ΝΟΜΟΣ ΦΛΩΡΙΝΗΣ,ΔΥΤΙΚΗΣ ΜΑΚΕΔΟΝΙΑΣ,ΑΕΤΟΣ ΦΛΩΡΙΝΑΣ,24003,2386041614,2486041615,d.aetou-florinis@kep.gov.gr,
253,260,ΚΕΠ ΝΟΜΑΡΧΙΑΚΗΣ ΑΥΤΟΔΙΟΙΚΗΣΗΣ ΜΕΣΣΗΝΙΑΣ,ΚΑΛΑΜΑΤΑ,ΝΟΜΟΣ ΜΕΣΣΗΝΙΑΣ,ΠΕΛΟΠΟΝΝΗΣΟΥ,ΔΙΟΙΚΗΤΗΡΙΟ -,24100,2721044215 2721044280,2721022286,n.messinias@kep.gov.gr,
254,261,"ΚΕΠ ΔΗΜΟΥ ΠΛΑΤΑΝΟΥ, Ν ΑΙΤΩΛΟΑΚΑΡΝΑΝΙΑΣ",ΔΗΜΟΥ ΠΛΑΤΑΝΟΥ,ΝΟΜΟΣ ΑΙΤΩΛΟΑΚΑΡΝΑΝΙΑΣ,ΔΥΤΙΚΗΣ ΕΛΛΑΔΑΣ,ΔΗΜΟΥ ΠΛΑΤΑΝΟΥ,30022,2634062177,2634062178,d.platanou@kep.gov.gr,
255,262,"ΚΕΠ ΔΗΜΟΥ ΝΕΑΠΟΛΗΣ, Ν ΑΙΤΩΛΟΑΚΑΡΝΑΝΙΑΣ",Νεάπολη Αιτωλοακαρνανίας,ΝΟΜΟΣ ΑΙΤΩΛΟΑΚΑΡΝΑΝΙΑΣ,ΔΥΤΙΚΗΣ ΕΛΛΑΔΑΣ,Νεάπολη,30100,2641039678,2641029001,d.neapolis-aitoloakarnanias@kep.gov.gr,
256,263,"ΚΕΠ ΚΟΙΝΟΤΗΤΑΣ ΑΧΛΑΔΟΚΑΜΠΟΥ, Ν ΑΡΓΟΛΙΔΑΣ",Αχλαδοκαμπος Ηλειας,ΝΟΜΟΣ ΑΡΓΟΛΙΔΟΣ,ΠΕΛΟΠΟΝΝΗΣΟΥ,Αχλαδόκαμπος,22100,2751081286,,k.ahladokampou@kep.gov.gr,
257,264,"ΚΕΠ ΔΗΜΟΥ ΑΣΙΝΗΣ, Ν ΑΡΓΟΛΙΔΑΣ",ΤΟΛΟ,ΝΟΜΟΣ ΑΡΓΟΛΙΔΟΣ,ΠΕΛΟΠΟΝΝΗΣΟΥ,ΣΕΚΕΡΗ 47,21056,2752059559,2752059559,d.asinis@kep.gov.gr,
258,265,ΚΕΠ ΔΗΜΟΥ ΠΕΝΤΕΛΗΣ Ν ΑΤΤΙΚΗΣ,ΠΕΝΤΕΛΗ,ΝΟΜΑΡΧΙΑΚΟ ΔΙΑΜΕΡΙΣΜΑ ΑΘΗΝΩΝ-ΑΝΑΤΟΛΙΚΟΣ ΤΟΜΕΑΣ,ΑΤΤΙΚΗΣ,Ηγ. Μακρυγιάννη 2,15236,2108105202,2108105203,k.pentelis@kep.gov.gr,
259,266,"ΚΕΠ ΔΗΜΟΥ ΔΕΡΒΕΝΟΧΩΡΙΩΝ, Ν ΒΟΙΩΤΙΑΣ",Βοιωτία,ΝΟΜΟΣ ΒΟΙΩΤΙΑΣ,ΣΤΕΡΕΑΣ ΕΛΛΑΔΑΣ,Πύλη (Ισόγειο Δημοτικού Μεγάρου),19012,2263031000,2263031775,d.dervenohorion@kep.gov.gr,
260,267,"ΚΕΠ ΔΗΜΟΥ ΒΑΓΙΩΝ, Ν ΒΟΙΩΤΙΑΣ",Βάγια Θηβών,ΝΟΜΟΣ ΒΟΙΩΤΙΑΣ,ΣΤΕΡΕΑΣ ΕΛΛΑΔΑΣ,Βαγίων Θηβών,32002,2262062907,2262062259,d.vagion@kep.gov.gr,
261,268,"ΚΕΠ ΔΗΜΟΥ ΚΑΤΩ ΝΕΥΡΟΚΟΠΙΟΥ, Ν ΔΡΑΜΑΣ",Κάτω Νευροκόπι Δράμας,ΝΟΜΑΡΧΙΑΚΟ ΔΙΑΜΕΡΙΣΜΑ ΔΡΑΜΑΣ,ΑΝΑΤΟΛΙΚΗΣ ΜΑΚΕΔΟΝΙΑΣ ΚΑΙ ΘΡΑΚΗΣ,Αγίου Δημητρίου 9,66033,2523021057,2523021057,d.knevrokopiou@kep.gov.gr,
262,269,"ΚΕΠ ΔΗΜΟΥ ΚΥΠΡΙΝΟΥ, Ν ΕΒΡΟΥ",Κυπρίνος Eβρου,ΝΟΜΑΡΧΙΑΚΟ ΔΙΑΜΕΡΙΣΜΑ ΕΒΡΟΥ,ΑΝΑΤΟΛΙΚΗΣ ΜΑΚΕΔΟΝΙΑΣ ΚΑΙ ΘΡΑΚΗΣ,Ελευθερίου Βενιζέλου 50,68006,2556021024,2556021023,d.kyprinou@kep.gov.gr,
263,270,"ΚΕΠ ΔΗΜΟΥ ΕΛΥΜΝΙΩΝ, Ν ΕΥΒΟΙΑΣ",ΛΙΜΝΗ ΕΥΒΟΙΑΣ,ΝΟΜΟΣ ΕΥΒΟΙΑΣ,ΣΤΕΡΕΑΣ ΕΛΛΑΔΑΣ,ΛΙΜΝΗ ΕΥΒΟΙΑΣ,34005,2227029112,2227029115,d.elymnion@kep.gov.gr,
264,271,"ΚΕΠ ΔΗΜΟΥ ΑΣΠΡΟΠΟΤΑΜΟΥ, Ν ΕΥΡΥΤΑΝΙΑΣ",Ευρυτανία,ΝΟΜΟΣ ΕΥΡΥΤΑΝΙΑΣ,ΣΤΕΡΕΑΣ ΕΛΛΑΔΑΣ,Ραπτόπουλο,36070,2237097072,2237097070,d.aspropotamou@kep.gov.gr,
265,272,"ΚΕΠ ΔΗΜΟΥ ΓΑΣΤΟΥΝΗΣ, Ν ΗΛΕΙΑΣ",Γαστούνη Ηλείας,ΝΟΜΟΣ ΗΛΕΙΑΣ,ΔΥΤΙΚΗΣ ΕΛΛΑΔΑΣ,Στρατηγού Σισίνη 115,27300,2623035832,2623035829,d.gastounis@kep.gov.gr,
266,273,"ΚΕΠ ΔΗΜΟΥ ΒΕΡΟΙΑΣ, Ν ΗΜΑΘΙΑΣ",Βέροια Ημαθίας,ΝΟΜΟΣ ΗΜΑΘΙΑΣ,ΚΕΝΤΡΙΚΗΣ ΜΑΚΕΔΟΝΙΑΣ,ΜΗΤΡΟΠΟΛΕΩΣ 55,59100,2331077500,2331077900,d.veroias@kep.gov.gr,
267,274,"ΚΕΠ ΔΗΜΟΥ ΡΟΥΒΑ, Ν ΗΡΑΚΛΕΙΟΥ",Γέργερη Ηρακλείου Κρήτης,ΝΟΜΟΣ ΗΡΑΚΛΕΙΟΥ,ΚΡΗΤΗΣ,Γέργερη Ηρακλείου Κρήτης -,70003,2894340300 2894340323 2894340325 2894340309,2894340315,d.rouva@kep.gov.gr,
268,275,"ΚΕΠ ΔΗΜΟΥ ΚΑΣΤΕΛΛΙΟΥ, Ν. ΗΡΑΚΛΕΙΟΥ",Καστέλη Πεδιάδας Ηρακλείου,ΝΟΜΟΣ ΗΡΑΚΛΕΙΟΥ,ΚΡΗΤΗΣ,28ης Οκτωβρίου,70006,2891032810,2891032773,d.kastelliou@kep.gov.gr,
269,276,"ΚΕΠ ΚΟΙΝΟΤΗΤΑΣ ΣΟΥΛΙΟΥ, Ν ΘΕΣΠΡΩΤΙΑΣ",Σαμονίδα Θεσπρωτίας,ΝΟΜΟΣ ΘΕΣΠΡΩΤΙΑΣ,ΗΠΕΙΡΟΥ,Σαμονίδα Σουλίου,46031,2666024613,2666024614,k.soyliou@kep.gov.gr,
270,277,"ΚΕΠ ΚΟΙΝΟΤΗΤΑΣ ΠΕΡΔΙΚΑΣ, Ν ΘΕΣΠΡΩΤΙΑΣ",Πέρδικα Θεσπρωτίας,ΝΟΜΟΣ ΘΕΣΠΡΩΤΙΑΣ,ΗΠΕΙΡΟΥ,Πλατεία Ελευθερίας 18,46100,2665097025,2665097024,k.perdikas@kep.gov.gr,
271,278,"ΚΕΠ ΔΗΜΟΥ ΑΧΕΡΟΝΤΑ, Ν ΘΕΣΠΡΩΤΙΑΣ",,ΝΟΜΟΣ ΘΕΣΠΡΩΤΙΑΣ,ΗΠΕΙΡΟΥ,Γαρδίκι,46031,2666049004,2666049007,d.aheronta@kep.gov.gr,
272,279,"ΚΕΠ ΔΗΜΟΥ ΣΥΒΟΤΩΝ, Ν ΘΕΣΠΡΩΤΙΑΣ",ΣΥΒΟΤΑ ΘΕΣΠΡΩΤΙΑΣ,ΝΟΜΟΣ ΘΕΣΠΡΩΤΙΑΣ,ΗΠΕΙΡΟΥ,Περικλέους & Ελευθερίας,46100,2665071474 - 2665071595,2665098009,d.syvoton@kep.gov.gr,
273,280,ΚΕΠ ΔΗΜΟΥ ΛΑΧΑΝΑ Ν. ΘΕΣΣΑΛΟΝΙΚΗΣ,Θεσσαλονίκη,ΝΟΜΟΣ ΘΕΣΣΑΛΟΝΙΚΗΣ,ΚΕΝΤΡΙΚΗΣ ΜΑΚΕΔΟΝΙΑΣ,Ξυλόπολη,57017,2394020678,2394020679,d.lahana@kep.gov.gr,
274,281,ΚΕΠ ΔΗΜΟΥ ΘΕΡΜΑΙΚΟΥ Ν. ΘΕΣΣΑΛΟΝΙΚΗΣ,Νέοι Επιβάτες Θεσσαλονίκη,ΝΟΜΟΣ ΘΕΣΣΑΛΟΝΙΚΗΣ,ΚΕΝΤΡΙΚΗΣ ΜΑΚΕΔΟΝΙΑΣ,Λογοθέτου 1,57019,2392026099,2392028366,d.thermaikou@kep.gov.gr,
275,282,"ΚΕΠ ΔΗΜΟΥ ΑΓΙΟΥ ΠΑΥΛΟΥ, Ν ΘΕΣΣΑΛΟΝΙΚΗΣ",Θεσσαλονίκη,ΝΟΜΟΣ ΘΕΣΣΑΛΟΝΙΚΗΣ,ΚΕΝΤΡΙΚΗΣ ΜΑΚΕΔΟΝΙΑΣ,ΛΕΩΦΟΡΟΣ ΟΧΙ - ΑΓ. ΠΑΥΛΟΥ 3,55438,2310968104,2310968103,d.agpavlou@kep.gov.gr,
276,283,"ΚΕΠ ΔΗΜΟΥ ΑΝΩ ΚΑΛΑΜΑ, Ν ΙΩΑΝΝΙΝΩΝ",Παρακάλαμος Ιωάννινα,ΝΟΜΟΣ ΙΩΑΝΝΙΝΩΝ,ΗΠΕΙΡΟΥ,Παρακάλαμος,44004,2653032000,2653032001,d.anokalama@kep.gov.gr,
277,284,"ΚΕΠ ΔΗΜΟΥ ΚΕΝΤΡΙΚΟΥ ΖΑΓΟΡΙΟΥ, Ν ΙΩΑΝΝΙΝΩΝ",-,ΝΟΜΟΣ ΙΩΑΝΝΙΝΩΝ,ΗΠΕΙΡΟΥ,ΑΣΠΡΑΓΓΕΛΟΙ -,44007,2653022834 2653360318 2653360319,2653022835,d.kentrzagoriou@kep.gov.gr,
278,285,"ΚΕΠ ΔΗΜΟΥ ΚΟΝΙΤΣΑΣ, Ν ΙΩΑΝΝΙΝΩΝ",-,ΝΟΜΟΣ ΙΩΑΝΝΙΝΩΝ,ΗΠΕΙΡΟΥ,Κόνιτσα -,44100,2655029344,2655023900,d.konitsas@kep.gov.gr,
279,286,"ΚΕΠ ΔΗΜΟΥ ΕΚΑΛΗΣ, Ν ΙΩΑΝΝΙΝΩΝ",Μεταμόρφωση Ιωαννίνων,ΝΟΜΟΣ ΙΩΑΝΝΙΝΩΝ,ΗΠΕΙΡΟΥ,Μεταμόρφωση Δήμου Εκάλης Ιωαννίνων,45900,2653022880,2653022880,d.ekalis@kep.gov.gr,
280,287,"ΚΕΠ ΔΗΜΟΥ ΑΓΙΟΥ ΓΕΩΡΓΙΟΥ, Ν ΚΕΡΚΥΡΑΣ",Κέρκυρα,ΝΟΜΟΣ ΚΕΡΚΥΡΑΣ,ΙΟΝΙΩΝ ΝΗΣΩΝ,Αγρός,49083,2663072697,2663072698,d.aggeorgiou-kerkiras@kep.gov.gr,
281,288,"ΚΕΠ ΔΗΜΟΥ ΠΑΛΑΙΟΚΑΣΤΡΙΤΩΝ, Ν ΚΕΡΚΥΡΑΣ",Κέρκυρα,ΝΟΜΟΣ ΚΕΡΚΥΡΑΣ,ΙΟΝΙΩΝ ΝΗΣΩΝ,Εθνική Παλαιοκαστρίτσας Θέση Σταυρός,49083,2663042120,2663042160,d.palaiokastriton@kep.gov.gr,
282,289,"ΚΕΠ ΔΗΜΟΥ ΘΙΝΑΛΙΟΥ, Ν ΚΕΡΚΥΡΑΣ",ΑΧΑΡΑΒΗ ΚΕΡΚΥΡΑΣ,ΝΟΜΟΣ ΚΕΡΚΥΡΑΣ,ΙΟΝΙΩΝ ΝΗΣΩΝ,,49081,2663064868,2663064866,d.thinaliou@kep.gov.gr,
283,290,"ΚΕΠ ΔΗΜΟΥ ΜΟΥΡΙΚΙΟΥ, Ν ΚΟΖΑΝΗΣ",Εμποριό Κοζάνης,ΝΟΜΟΣ ΚΟΖΑΝΗΣ,ΔΥΤΙΚΗΣ ΜΑΚΕΔΟΝΙΑΣ,Εμποριό Μουρικίου,50005,2463062283,2463062138,d.mourikiou@kep.gov.gr,
284,291,"ΚΕΠ ΔΗΜΟΥ ΕΛΛΗΣΠΟΝΤΟΥ, Ν ΚΟΖΑΝΗΣ",Κοζάνη,ΝΟΜΟΣ ΚΟΖΑΝΗΣ,ΔΥΤΙΚΗΣ ΜΑΚΕΔΟΝΙΑΣ,Ρυάκιο,50100,2461094515,2461094516,d.ellispontou@kep.gov.gr,
285,292,"ΚΕΠ ΔΗΜΟΥ ΜΟΝΕΜΒΑΣΙΑΣ, Ν ΛΑΚΩΝΙΑΣ",Μονεμβασιά Λακωνίας,ΝΟΜΟΣ ΛΑΚΩΝΙΑΣ,ΠΕΛΟΠΟΝΝΗΣΟΥ,Μονεμβασιά,23070,2732061111,2732062110,d.monemvasias@kep.gov.gr,
286,293,"ΚΕΠ ΔΗΜΟΥ ΝΕΣΣΩΝΟΣ, Ν ΛΑΡΙΣΗΣ",ΣΥΚΟΥΡΙΟ,ΝΟΜΟΣ ΛΑΡΙΣΗΣ,ΘΕΣΣΑΛΙΑΣ,Πλ.Ρήγα Φεραίου,40006,2495052900,2495052901,d.nessonos@kep.gov.gr,
287,294,"ΚΕΠ ΔΗΜΟΥ ΙΤΑΝΟΥ, Ν ΛΑΣΙΘΙΟΥ",ΖΑΚΡΟΣ ΛΑΣΙΘΙΟΥ,ΝΟΜΟΣ ΛΑΣΙΘΙΟΥ,ΚΡΗΤΗΣ,ΖΑΚΡΟΣ ΛΑΣΙΘΙΟΥ 5,72300,2843029626,2843029627,d.itanou@kep.gov.gr,
288,295,"ΚΕΠ ΚΟΙΝΟΤΗΤΑ ΤΡΙΚΟΡΦΟΥ, Ν ΜΕΣΣΗΝΙΑΣ",Τρίκορφο,ΝΟΜΟΣ ΜΕΣΣΗΝΙΑΣ,ΠΕΛΟΠΟΝΝΗΣΟΥ,Τρίκορφο,24013,2722061244,2722061244,k.trikorfou@kep.gov.gr,
289,296,"ΚΕΠ ΔΗΜΟΥ ΘΟΥΡΙΑΣ, Ν ΜΕΣΣΗΝΙΑΣ",ΘΟΥΡΙΑ ΜΕΣΣΗΝΙΑΣ,ΝΟΜΟΣ ΜΕΣΣΗΝΙΑΣ,ΠΕΛΟΠΟΝΝΗΣΟΥ,ΚΤΙΡΙΟ ΔΗΜΑΡΧΕΙΟΥ -,24009,2721360236 2721360211,2721064206,d.thourias@kep.gov.gr,
290,297,"ΚΕΠ ΚΟΙΝΟΤΗΤΑ ΤΡΙΠΥΛΑΣ, Ν ΜΕΣΣΗΝΙΑΣ",Σέλλα,ΝΟΜΟΣ ΜΕΣΣΗΝΙΑΣ,ΠΕΛΟΠΟΝΝΗΣΟΥ,Σέλλα,24500,2761025461,2761025461,k.tripylas@kep.gov.gr,
291,298,"ΚΕΠ ΔΗΜΟΥ ΑΥΛΩΝΟΣ, Ν ΜΕΣΣΗΝΙΑΣ",Καλό Νερό Μεσσηνίας,ΝΟΜΟΣ ΜΕΣΣΗΝΙΑΣ,ΠΕΛΟΠΟΝΝΗΣΟΥ,Καλό Νερό Μεσσηνίας,24500,2761062555,2761071275,d.avlonos-messinias@kep.gov.gr,
292,299,"ΚΕΠ ΔΗΜΟΥ ΑΡΙΟΥ, Ν ΜΕΣΣΗΝΙΑΣ","ΑΡΙΟΥ, Ν ΜΕΣΣΗΝΙΑΣ",ΝΟΜΟΣ ΜΕΣΣΗΝΙΑΣ,ΠΕΛΟΠΟΝΝΗΣΟΥ,"ΑΡΙΟΥ, Ν ΜΕΣΣΗΝΙΑΣ",24009,2721051801,2721051782,d.arios@kep.gov.gr,
293,300,"ΚΕΠ ΔΗΜΟΥ ΑΧΕΛΩΟΥ, Ν ΚΑΡΔΙΤΣΑΣ","Αχελώου, Ν Καρδίτσας",ΝΟΜΟΣ ΚΑΡΔΙΤΣΑΣ,ΘΕΣΣΑΛΙΑΣ,"Αχελώου, Ν Καρδίτσας",43066,2445031342,2685061204,d.aheloou@kep.gov.gr,
294,301,"ΚΕΠ ΔΗΜΟΥ ΕΞΑΠΛΑΤΑΝΟΥ, Ν ΠΕΛΛΗΣ",Εξαπλάτανος Νομού Πέλλας,ΝΟΜΟΣ ΠΕΛΛΗΣ,ΚΕΝΤΡΙΚΗΣ ΜΑΚΕΔΟΝΙΑΣ,"Φιλικής Εταιρίας, Εξαπλάτανος 3",58004,2384042204,2384042207,d.exaplatanou@kep.gov.gr,
295,302,"ΚΕΠ ΔΗΜΟΥ ΠΙΕΡΙΩΝ, Ν ΠΙΕΡΙΑΣ",Ρητίνη Πιερίας,ΝΟΜΟΣ ΠΙΕΡΙΑΣ,ΚΕΝΤΡΙΚΗΣ ΜΑΚΕΔΟΝΙΑΣ,Ρητίνη Πιερίας -,60100,2351086011 2351086013 2351086014,2351086015,d.pierion@kep.gov.gr,
296,303,"ΚΕΠ ΔΗΜΟΥ ΝΙΚΗΦΟΡΟΥ ΦΩΚΑ, Ν ΡΕΘΥΜΝΗΣ",-,ΝΟΜΟΣ ΡΕΘΥΜΝΗΣ,ΚΡΗΤΗΣ,Ατσιπόπουλο,74100,2831032413,2831032415,d.nikiforoufoka@kep.gov.gr,
297,304,"ΚΕΠ ΔΗΜΟΥ ΚΟΥΡΗΤΩΝ, Ν ΡΕΘΥΜΝΗΣ",Φουρφουράς Ρέθυμνο,ΝΟΜΟΣ ΡΕΘΥΜΝΗΣ,ΚΡΗΤΗΣ,Φουρφουράς Ρεθύμνου,74061,2833041312,2833041313,d.kouriton@kep.gov.gr,
298,305,ΚΕΠ ΔΗΜΟΥ ΝΕΟΥ ΣΙΔΗΡΟΧΩΡΙΟΥ Ν. ΡΟΔΟΠΗΣ,Νέο Σιδηροχώρι,ΝΟΜΑΡΧΙΑΚΟ ΔΙΑΜΕΡΙΣΜΑ ΡΟΔΟΠΗΣ,ΑΝΑΤΟΛΙΚΗΣ ΜΑΚΕΔΟΝΙΑΣ ΚΑΙ ΘΡΑΚΗΣ,Νέο Σιδηροχώρι,69100,2531089010,2531051406,d.neousidirohoriou@kep.gov.gr,
299,306,"ΚΕΠ ΔΗΜΟΥ ΣΑΠΩΝ, Ν ΡΟΔΟΠΗΣ",ΣΑΠΕΣ,ΝΟΜΑΡΧΙΑΚΟ ΔΙΑΜΕΡΙΣΜΑ ΡΟΔΟΠΗΣ,ΑΝΑΤΟΛΙΚΗΣ ΜΑΚΕΔΟΝΙΑΣ ΚΑΙ ΘΡΑΚΗΣ,ΠΑΠΑΔΗΜΑ 2,69300,2532021006 2532021007,2532021006,d.sapon@kep.gov.gr,
300,307,"ΚΕΠ ΔΗΜΟΥ ΜΕΛΙΤΗΣ, Ν ΦΛΩΡΙΝΗΣ",Μελίτη Φλώρινας,ΝΟΜΟΣ ΦΛΩΡΙΝΗΣ,ΔΥΤΙΚΗΣ ΜΑΚΕΔΟΝΙΑΣ,Μελίτη,,2385039000,2385039001,d.melitis@kep.gov.gr,
301,308,"ΚΕΠ ΝΟΜΑΡΧΙΑΚΟΥ ΔΙΑΜΕΡΙΣΜΑΤΟΣ ΑΘΗΝΑΣ, ΤΗΣ ΕΝΙΑΙΑΣ ΝΟΜΑΡΧΙΑΚΗΣ ΑΥΤΟΔΙΟΙΚΗΣΗΣ ΑΘΗΝΩΝ - ΠΕΙΡΑΙΩΣ",ΑΜΠΕΛΟΚΗΠΟΙ,ΝΟΜΑΡΧΙΑΚΟ ΔΙΑΜΕΡΙΣΜΑ ΑΘΗΝΩΝ-ΚΕΝΤΡΙΚΟΣ ΤΟΜΕΑΣ,ΑΤΤΙΚΗΣ,ΚΗΦΙΣΙΑΣ 125 - 127,11524,2106993630 2106993629 2106993628,2106993627,n.athinon@kep.gov.gr,
302,309,ΚΕΠ ΝΟΜΑΡΧΙΑΚΗΣ ΑΥΤΟΔΙΟΙΚΗΣΗΣ ΑΝΑΤΟΛΙΚΗΣ ΑΤΤΙΚΗΣ,ΠΑΛΛΗΝΗ,ΝΟΜΑΡΧΙΑΚΗ ΑΥΤΟΔΙΟΙΚΗΣΗ ΑΝΑΤΟΛΙΚΗΣ ΑΤΤΙΚΗΣ,ΑΤΤΙΚΗΣ,17ο χιλ ΛΕΩΦ.ΜΑΡΑΘΩΝΟΣ,15351,2106033574,2106664900,n.anatolikisattikis@kep.gov.gr,
303,310,ΚΕΠ ΝΟΜΑΡΧΙΑΚΗΣ ΑΥΤΟΔΙΟΙΚΗΣΗΣ ΔΥΤΙΚΗΣ ΑΤΤΙΚΗΣ,Ελευσίνα Αττικής,ΝΟΜΑΡΧΙΑΚΗ ΑΥΤΟΔΙΟΙΚΗΣΗ ΔΥΤΙΚΗΣ ΑΤΤΙΚΗΣ,ΑΤΤΙΚΗΣ,Εθνικής Αντιστάσεως & Περσεφόνης 109,19200,2105565293,2105541697,n.dytikisattikis@kep.gov.gr,
304,311,"ΚΕΠ ΝΟΜΑΡΧΙΑΚΟΥ ΔΙΑΜΕΡΙΣΜΑΤΟΣ ΠΕΙΡΑΙΩΣ, ΤΗΣ ΕΝΙΑΙΑΣ ΝΟΜΑΡΧΙΑΚΗΣ ΑΥΤΟΔΙΟΙΚΗΣΗΣ ΑΘΗΝΩΝ - ΠΕΙΡΑΙΩΣ",ΚΕΡΑΤΣΙΝΙ,ΝΟΜΑΡΧΙΑΚΟ ΔΙΑΜΕΡΙΣΜΑ ΠΕΙΡΑΙΩΣ,ΑΤΤΙΚΗΣ,ΑΡΙΑΔΝΗΣ 2 και ΠΗΝΕΙΟΥ 4,18757,2104257543,,n.peiraios@kep.gov.gr,
305,312,ΚΕΠ ΝΟΜ ΑΥΤ ΔΡΑΜΑΣ-ΚΑΒΑΛΑΣ-ΞΑΝΘΗΣ ΝΟΜ ΔΙΑΜΕΡ ΔΡΑΜΑΣ,ΔΙΟΙΚΗΤΗΡΙΟ,ΝΟΜΑΡΧΙΑΚΟ ΔΙΑΜΕΡΙΣΜΑ ΔΡΑΜΑΣ,ΑΝΑΤΟΛΙΚΗΣ ΜΑΚΕΔΟΝΙΑΣ ΚΑΙ ΘΡΑΚΗΣ,ΔΙΟΙΚΗΤΗΡΙΟ,66100,2521062371,2521062367,n.dramas@kep.gov.gr,
306,313,"ΚΕΠ ΝΟΜΑΡΧΙΑΚΟΥ ΔΙΑΜΕΡΙΣΜΑΤΟΣ ΕΒΡΟΥ, ΤΗΣ ΕΝΙΑΙΑΣ ΝΟΜΑΡΧΙΑΚΗΣ ΑΥΤΟΔΙΟΙΚΗΣΗΣ ΡΟΔΟΠΗΣ- ΕΒΡΟΥ",ΑΛΕΞΑΝΔΡΟΥΠΟΛΗ,ΝΟΜΑΡΧΙΑΚΟ ΔΙΑΜΕΡΙΣΜΑ ΕΒΡΟΥ,ΑΝΑΤΟΛΙΚΗΣ ΜΑΚΕΔΟΝΙΑΣ ΚΑΙ ΘΡΑΚΗΣ,ΚΑΡΑΟΛΗ & ΔΗΜΗΤΡΙΟΥ 40,68100,2551088248,2551088247,n.evrourodopis@kep.gov.gr,
307,314,"ΚΕΠ ΝΟΜΑΡΧΙΑΚΟΥ ΔΙΑΜΕΡΙΣΜΑΤΟΣ ΞΑΝΘΗΣ, ΤΗΣ ΕΝΙΑΙΑΣ ΝΟΜΑΡΧΙΑΚΗΣ ΑΥΤΟΔΙΟΙΚΗΣΗΣ ΔΡΑΜΑΣ-ΚΑΒΑΛΑΣ-ΞΑΝΘΗΣ",Ξάνθη,ΝΟΜΑΡΧΙΑΚΟ ΔΙΑΜΕΡΙΣΜΑ ΞΑΝΘΗΣ,ΑΝΑΤΟΛΙΚΗΣ ΜΑΚΕΔΟΝΙΑΣ ΚΑΙ ΘΡΑΚΗΣ,Διοικητήριο,67100,2541083961,2541083963,n.xanthis@kep.gov.gr,
308,315,ΚΕΠ ΝΟΜΑΡΧΙΑΚΗΣ ΑΥΤΟΔΙΟΙΚΗΣΗΣ ΛΕΣΒΟΥ,ΜΥΤΙΛΗΝΗ,ΝΟΜΟΣ ΛΕΣΒΟΥ,ΒΟΡΕΙΟΥ ΑΙΓΑΙΟΥ,Αγίας Ειρήνης 10,81100,2251037181,2251042467,n.lesvou@kep.gov.gr,
309,316,ΚΕΠ ΝΟΜΑΡΧΙΑΚΗΣ ΑΥΤΟΔΙΟΙΚΗΣΗΣ ΣΑΜΟΥ,ΔΙΟΙΚΗΤΗΡΙΟ ΣΑΜΟΣ,ΝΟΜΟΣ ΣΑΜΟΥ,ΒΟΡΕΙΟΥ ΑΙΓΑΙΟΥ,ΔΕΡΒΕΝΑΚΙΩΝ -,83100,2273080004 2273087351,2273087464,n.samou@kep.gov.gr,
310,317,ΚΕΠ ΝΟΜΑΡΧΙΑΚΗΣ ΑΥΤΟΔΙΟΙΚΗΣΗΣ ΑΧΑΙΑΣ,Πάτρα,ΝΟΜΟΣ ΑΧΑΪΑΣ,ΔΥΤΙΚΗΣ ΕΛΛΑΔΑΣ,Βότση 37,26221,2610243400,2610243403,n.ahaias@kep.gov.gr,
311,318,ΚΕΠ ΝΟΜΑΡΧΙΑΚΗΣ ΑΥΤΟΔΙΟΙΚΗΣΗΣ ΗΛΕΙΑΣ,ΠΥΡΓΟΣ ΗΛΙΕΙΑΣ,ΝΟΜΟΣ ΗΛΕΙΑΣ,ΔΥΤΙΚΗΣ ΕΛΛΑΔΑΣ,ΜΑΝΟΛΩΠΟΥΛΟΥ 31,27100,2621033290,2621034763,n.ileias@kep.gov.gr,
312,319,ΚΕΠ ΝΟΜΑΡΧΙΑΚΗΣ ΑΥΤΟΔΙΟΙΚΗΣΗΣ ΚΑΣΤΟΡΙΑΣ,Καστοριά,ΝΟΜΟΣ ΚΑΣΤΟΡΙΑΣ,ΔΥΤΙΚΗΣ ΜΑΚΕΔΟΝΙΑΣ,Διοικητήριο,52100,2467021200,2467021201,n.kastorias@kep.gov.gr,
313,320,ΚΕΠ ΝΟΜΑΡΧΙΑΚΗΣ ΑΥΤΟΔΙΟΙΚΗΣΗΣ ΦΛΩΡΙΝΗΣ,ΦΛΩΡΙΝΑ ΔΙΟΙΚΗΤΗΡΙΟ,ΝΟΜΟΣ ΦΛΩΡΙΝΗΣ,ΔΥΤΙΚΗΣ ΜΑΚΕΔΟΝΙΑΣ,ΠΤΟΛΕΜΑΙΩΝ 1,53100,2385044636,2385044634,n.florinas@kep.gov.gr,
314,321,ΚΕΠ ΝΟΜΑΡΧΙΑΚΗΣ ΑΥΤΟΔΙΟΙΚΗΣΗΣ ΑΡΤΑΣ,ΑΡΤΑ,ΝΟΜΟΣ ΑΡΤΑΣ,ΗΠΕΙΡΟΥ,Β.ΚΩΝΣΤΑΝΤΙΝΟΥ 109,47100,2681021516,2681021518,n.artis@kep.gov.gr,
315,322,ΚΕΠ ΝΟΜΑΡΧΙΑΚΗΣ ΑΥΤΟΔΙΟΙΚΗΣΗΣ ΙΩΑΝΝΙΝΩΝ,ΚΕΝΤΡΙΚΗ ΠΛΑΤΕΙΑ ΙΩΑΝΝΙΝΩΝ,ΝΟΜΟΣ ΙΩΑΝΝΙΝΩΝ,ΗΠΕΙΡΟΥ,ΠΛΑΤΕΙΑ ΠΥΡΡΟΥ 1,45110,2651087103 - 2651087104,2651070173,n.ioanninon@kep.gov.gr,
316,323,ΚΕΠ ΝΟΜΑΡΧΙΑΚΗΣ ΑΥΤΟΔΙΟΙΚΗΣΗΣ ΠΡΕΒΕΖΗΣ,ΠΡΕΒΕΖΑ,ΝΟΜΟΣ ΠΡΕΒΕΖΗΣ,ΗΠΕΙΡΟΥ,ΣΠΗΛΙΑΔΟΥ 8,48100,2682360222 2682360223 2682360224 2682360225 2682360226 2682360227,2682360219,n.prevezis@kep.gov.gr,
317,324,ΚΕΠ ΝΟΜΑΡΧΙΑΚΗΣ ΑΥΤΟΔΙΟΙΚΗΣΗΣ ΚΑΡΔΙΤΣΑΣ,ΚΑΡΔΙΤΣΑ,ΝΟΜΟΣ ΚΑΡΔΙΤΣΑΣ,ΘΕΣΣΑΛΙΑΣ,ΚΟΥΜΟΥΝΔΟΥΡΟΥ 29,43100,2441079999,2441079442,n.karditsas@kep.gov.gr,
318,325,ΚΕΠ ΝΟΜΑΡΧΙΑΚΗΣ ΑΥΤΟΔΙΟΙΚΗΣΗΣ ΛΑΡΙΣΗΣ,ΔΙΟΙΚΗΤΗΡΙΟ,ΝΟΜΟΣ ΛΑΡΙΣΗΣ,ΘΕΣΣΑΛΙΑΣ,ΠΑΠΑΝΑΣΤΑΣΙΟΥ ΚΑΙ ΒΕΛΗ -,41110,2410597291 2410597225 2410597356,2410538682,n.larisis@kep.gov.gr,
