aa,kepCode,kepTitle,area,county,region,address,tk,phoneNumber,fax,email,comments
1,1,ΚΕΠ ΕΝΙΑΙΑΣ ΝΟΜΑΡΧΙΑΚΗΣ ΑΥΤΟΔΙΟΙΚΗΣΗΣ ΑΘΗΝΑΣ - ΠΕΙΡΑΙΑ,ΣΥΝΤΑΓΜΑ,ΝΟΜΑΡΧΙΑΚΟ ΔΙΑΜΕΡΙΣΜΑ ΑΘΗΝΩΝ-ΚΕΝΤΡΙΚΟΣ ΤΟΜΕΑΣ,ΑΤΤΙΚΗΣ,ΑΜΑΛΙΑΣ 2 & ΟΘΩΝΟΣ 10,10557,2103214640 2103214462,2103214448,p.attikis@kep.gov.gr,
2,2,ΚΕΠ ΝΟΜΑΡΧΙΑΚΗΣ ΑΥΤΟΔΙΟΙΚΗΣΗΣ Ν. ΘΕΣΣΑΛΟΝΙΚΗΣ (ΠΑΡΑΡΤΗΜΑ),ΘΕΣΣΑΛΟΝΙΚΗ,ΝΟΜΟΣ ΘΕΣΣΑΛΟΝΙΚΗΣ,ΚΕΝΤΡΙΚΗΣ ΜΑΚΕΔΟΝΙΑΣ,ΑΡΙΣΤΟΤΕΛΟΥΣ 19,54624,2310375027 2310375028 2310375030 2310375026,2310253262,n.thessalonikis-parartima@kep.gov.gr,
3,3,ΚΕΠ ΔΗΜΟΥ ΠΕΙΡΑΙΑ Ν. ΑΤΤΙΚΗΣ,ΠΕΙΡΑΙΣΑ Ν. ΑΤΤΙΚΗΣ,ΝΟΜΑΡΧΙΑΚΟ ΔΙΑΜΕΡΙΣΜΑ ΠΕΙΡΑΙΩΣ,ΑΤΤΙΚΗΣ,ΑΚΤΗ ΠΟΣΕΙΔΩΝΟΣ 2,18531,2104146000,2104102479,d.peiraios@kep.gov.gr,
4,4,ΚΕΠ ΔΗΜΟΥ ΠΕΡΙΣΤΕΡΙΟΥ Ν. ΑΤΤΙΚΗΣ,Περιστέρι Αθήνα,ΝΟΜΑΡΧΙΑΚΟ ΔΙΑΜΕΡΙΣΜΑ ΑΘΗΝΩΝ-ΔΥΤΙΚΟΣ ΤΟΜΕΑΣ,ΑΤΤΙΚΗΣ,Εθνάρχου Μακαρίου 44,12132,2105786962,2105759676,d.peristeriou@kep.gov.gr,
5,5,ΚΕΠ ΔΗΜΟΥ ΑΜΑΡΟΥΣΙΟΥ Ν. ΑΤΤΙΚΗΣ,Μαρούσι Αττικής,ΝΟΜΑΡΧΙΑΚΟ ΔΙΑΜΕΡΙΣΜΑ ΑΘΗΝΩΝ-ΑΝΑΤΟΛΙΚΟΣ ΤΟΜΕΑΣ,ΑΤΤΙΚΗΣ,Β. Σοφίας 9,15124,2108760090,2106146907,d.amarousiou@kep.gov.gr,
6,6,ΚΕΠ ΔΗΜΟΥ ΗΡΑΚΛΕΙΟΥ ΚΡΗΤΗΣ Ν. ΗΡΑΚΛΕΙΟΥ,ΗΡΑΚΛΕΙΟ ΚΡΗΤΗΣ,ΝΟΜΟΣ ΗΡΑΚΛΕΙΟΥ,ΚΡΗΤΗΣ,ΑΝΔΡΟΓΕΩ 2,71202,2810276700,2810332707,d.irakleiou-kritis@kep.gov.gr,
7,7,ΚΕΠ ΔΗΜΟΥ ΧΕΡΣΟΝΗΣΟΥ Ν. ΗΡΑΚΛΕΙΟΥ,ΧΕΡΣΟΝΗΣΟΣ,ΝΟΜΟΣ ΗΡΑΚΛΕΙΟΥ,ΚΡΗΤΗΣ,ΕΛΕΥΘΕΡΙΑΣ 21,70014,2897028700,2897028701,d.hersonissou@kep.gov.gr,
8,8,ΚΕΠ ΔΗΜΟΥ ΡΕΘΥΜΝΗΣ Ν. ΡΕΘΥΜΝΗΣ,Ρέθυμνο Κρήτης,ΝΟΜΟΣ ΡΕΘΥΜΝΗΣ,ΚΡΗΤΗΣ,Λεωφόρος Κουντουριώτου 98,74100,2831341500 2831341501 2831341502 2831341503 2831341504 2831341505 2831341506 2831341508,2831341507,d.rethimnis@kep.gov.gr,
9,9,ΚΕΠ ΔΗΜΟΥ ΧΑΝΙΩΝ Ν. ΧΑΝΙΩΝ,ΧΑΝΙΑ,ΝΟΜΟΣ ΧΑΝΙΩΝ,ΚΡΗΤΗΣ,ΚΥΔΩΝΙΑΣ 29,73135,2821341800,2821341820,d.hanion@kep.gov.gr,
10,10,ΚΕΠ ΔΗΜΟΥ ΑΓ ΝΙΚΟΛΑΟΥ Ν. ΛΑΣΙΘΙΟΥ,ΑΓΙΟΣ ΝΙΚΟΛΑΟΣ,ΝΟΜΟΣ ΛΑΣΙΘΙΟΥ,ΚΡΗΤΗΣ,ΡΟΥΣΣΟΥ ΚΑΠΕΤΑΝΑΚΗ & ΚΟΝΤΟΓΙΑΝΝΑΚΗ,72100,2841089590,2841089595,d.agnikolaou@kep.gov.gr,
11,11,ΚΕΠ ΔΗΜΟΥ ΡΟΔΟΥ ΜΕ ΤΡΙΑ ΠΑΡΑΡΤΗΜΑΤΑ Ν. ΔΩΔΕΚΑΝΗΣΟΥ,ΜΕΣΑΙΩΝΙΚΗ ΠΟΛΗ ΡΟΔΟΥ,ΝΟΜΟΣ ΔΩΔΕΚΑΝΗΣΟΥ,ΝΟΤΙΟΥ ΑΙΓΑΙΟΥ,ΣΥΜΜΙΟΥ 12,85100,2241043707,2241043973,d.rodou@kep.gov.gr,
12,12,ΚΕΠ ΔΗΜΟΥ ΑΡΧΑΓΓΕΛΟΥ Ν. ΔΩΔΕΚΑΝΗΣΟΥ,Αρχάγγελος Δωδεκανήσου,ΝΟΜΟΣ ΔΩΔΕΚΑΝΗΣΟΥ,ΝΟΤΙΟΥ ΑΙΓΑΙΟΥ,"Πλατεία Δημαρχείου, Αρχάγγελος",85102,2244029180,2244029182,d.arhaggelou@kep.gov.gr,
13,13,ΚΕΠ ΔΗΜΟΥ ΑΣΤΥΠΑΛΑΙΑΣ Ν. ΔΩΔΕΚΑΝΗΣΟΥ,,ΝΟΜΟΣ ΔΩΔΕΚΑΝΗΣΟΥ,ΝΟΤΙΟΥ ΑΙΓΑΙΟΥ,Χώρα,85900,2243059850,2243059850,d.astypalaias@kep.gov.gr,
14,14,ΚΕΠ ΔΗΜΟΥ ΑΦΑΝΤΟΥ Ν. ΔΩΔΕΚΑΝΗΣΟΥ,"Ρόδος, Δωδεκάνησα",ΝΟΜΟΣ ΔΩΔΕΚΑΝΗΣΟΥ,ΝΟΤΙΟΥ ΑΙΓΑΙΟΥ,25η Μαρτίου 24,85103,2241053303,2241053307,d.afantou@kep.gov.gr,
15,15,ΚΕΠ ΔΗΜΟΥ ΚΑΜΕΙΡΟΥ Ν. ΔΩΔΕΚΑΝΗΣΟΥ,Παραδείσι - Ρόδου,ΝΟΜΟΣ ΔΩΔΕΚΑΝΗΣΟΥ,ΝΟΤΙΟΥ ΑΙΓΑΙΟΥ,"24η Ιούλη, Σορωνή",85106,2241042344,2241042343,d.kameirou@kep.gov.gr,
16,16,ΚΕΠ ΔΗΜΟΥ ΙΑΛΥΣΟΥ Ν. ΔΩΔΕΚΑΝΗΣΟΥ,ΙΑΛΥΣΟΥ Ν. ΔΩΔΕΚΑΝΗΣΟΥ,ΝΟΜΟΣ ΔΩΔΕΚΑΝΗΣΟΥ,ΝΟΤΙΟΥ ΑΙΓΑΙΟΥ,ΠΛΑΤΕΙΑ ΑΠΟΣΤΟΛΙΔΗ,85101,2241098305,2241098306,d.ialisou@kep.gov.gr,
17,17,ΚΕΠ ΔΗΜΟΥ ΠΕΤΑΛΟΥΔΩΝ Ν. ΔΩΔΕΚΑΝΗΣΟΥ,ΚΡΕΜΑΣΤΗ ΡΟΔΟΥ,ΝΟΜΟΣ ΔΩΔΕΚΑΝΗΣΟΥ,ΝΟΤΙΟΥ ΑΙΓΑΙΟΥ,ΛΕΩΦΟΡΟΣ ΕΛΕΥΘΕΡΙΑΣ 51,85104,2241096644,2241096643,d.petaloudon@kep.gov.gr,
18,18,ΚΕΠ ΔΗΜΟΥ ΚΑΛΛΙΘΕΑΣ Ν. ΔΩΔΕΚΑΝΗΣΟΥ,,ΝΟΜΟΣ ΔΩΔΕΚΑΝΗΣΟΥ,ΝΟΤΙΟΥ ΑΙΓΑΙΟΥ,Καλυθιές,85105,2241085892 2241085842 2241085821,2241085225,d.kallitheas-dodekanisou@kep.gov.gr,
19,19,ΚΕΠ ΔΗΜΟΥ ΗΡΑΚΛΕΙΔΩΝ Ν. ΔΩΔΕΚΑΝΗΣΟΥ,Δωδεκάνησος,ΝΟΜΟΣ ΔΩΔΕΚΑΝΗΣΟΥ,ΝΟΤΙΟΥ ΑΙΓΑΙΟΥ,Αντιμάχεια - Κω,85302,2242049289,2242049264,d.irakleidon@kep.gov.gr,
20,20,ΚΕΠ ΔΗΜΟΥ ΚΑΡΠΑΘΟΥ Ν. ΔΩΔΕΚΑΝΗΣΟΥ,ΠΗΓΑΔΙΑ ΚΑΡΠΑΘΟΥ,ΝΟΜΟΣ ΔΩΔΕΚΑΝΗΣΟΥ,ΝΟΤΙΟΥ ΑΙΓΑΙΟΥ,ΠΗΓΑΔΙΑ ΚΑΡΠΑΘΟΥ -,85700,2245029002,2245029004,d.karpathou@kep.gov.gr,
21,21,ΚΕΠ ΔΗΜΟΥ ΚΑΣΟΥ Ν. ΔΩΔΕΚΑΝΗΣΟΥ,"Κάσος, Δωδεκάνησα",ΝΟΜΟΣ ΔΩΔΕΚΑΝΗΣΟΥ,ΝΟΤΙΟΥ ΑΙΓΑΙΟΥ,Φρύ,85800,2245041865,2245041864,d.kasou@kep.gov.gr,
22,22,ΚΕΠ ΔΗΜΟΥ ΛΕΙΨΩΝ Ν. ΔΩΔΕΚΑΝΗΣΟΥ,Λειψοί - Δωδεκάνησα,ΝΟΜΟΣ ΔΩΔΕΚΑΝΗΣΟΥ,ΝΟΤΙΟΥ ΑΙΓΑΙΟΥ,Λειψοί,85001,2247028970,2247028999,d.leipson@kep.gov.gr,
23,23,ΚΕΠ ΔΗΜΟΥ ΛΕΡΟΥ Ν. ΔΩΔΕΚΑΝΗΣΟΥ,Λέρος Δωδεκάνησα,ΝΟΜΟΣ ΔΩΔΕΚΑΝΗΣΟΥ,ΝΟΤΙΟΥ ΑΙΓΑΙΟΥ,Πλάτανος Λέρου,85400,2247023400,2247023241,d.lerou@kep.gov.gr,
24,24,ΚΕΠ ΔΗΜΟΥ ΜΕΓΙΣΤΗΣ Ν. ΔΩΔΕΚΑΝΗΣΟΥ,Μεγίστη Καστελλόριζο,ΝΟΜΟΣ ΔΩΔΕΚΑΝΗΣΟΥ,ΝΟΤΙΟΥ ΑΙΓΑΙΟΥ,Μεγίστη Καστελλόριζο,85111,2246070670,2246070670,d.megistis@kep.gov.gr,
25,25,ΚΕΠ ΔΗΜΟΥ ΝΙΣΥΡΟΥ Ν. ΔΩΔΕΚΑΝΗΣΟΥ,Νίσυρος Δωδεκανήσου,ΝΟΜΟΣ ΔΩΔΕΚΑΝΗΣΟΥ,ΝΟΤΙΟΥ ΑΙΓΑΙΟΥ,Μανδράκι Νίσυρος,85303,2242048746,2242031198,d.nisyrou@kep.gov.gr,
26,26,ΚΕΠ ΔΗΜΟΥ ΝΟΤΙΑΣ ΡΟΔΟΥ Ν. ΔΩΔΕΚΑΝΗΣΟΥ,,ΝΟΜΟΣ ΔΩΔΕΚΑΝΗΣΟΥ,ΝΟΤΙΟΥ ΑΙΓΑΙΟΥ,Γενναδίου,85109,2244029110,2244043143,d.notiasrodou@kep.gov.gr,
27,27,ΚΕΠ ΔΗΜΟΥ ΛΙΝΔΙΩΝ Ν. ΔΩΔΕΚΑΝΗΣΟΥ,-,ΝΟΜΟΣ ΔΩΔΕΚΑΝΗΣΟΥ,ΝΟΤΙΟΥ ΑΙΓΑΙΟΥ,Δ.Δ.Λάρδου -,85109,2244044251,2244044250,d.lindion@kep.gov.gr,
28,28,ΚΕΠ ΔΗΜΟΥ ΠΑΤΜΟΥ Ν. ΔΩΔΕΚΑΝΗΣΟΥ,-,ΝΟΜΟΣ ΔΩΔΕΚΑΝΗΣΟΥ,ΝΟΤΙΟΥ ΑΙΓΑΙΟΥ,Σκάλα Πάτμου,85500,2247031158,2247033206,d.patmou@kep.gov.gr,
29,29,ΚΕΠ ΔΗΜΟΥ ΣΥΜΗΣ Ν. ΔΩΔΕΚΑΝΗΣΟΥ,ΣΥΜΗΣ,ΝΟΜΟΣ ΔΩΔΕΚΑΝΗΣΟΥ,ΝΟΤΙΟΥ ΑΙΓΑΙΟΥ,ΓΙΑΛΟΣ,85600,2246072568,2246071386,d.symis@kep.gov.gr,
30,30,ΚΕΠ ΔΗΜΟΥ ΤΗΛΟΥ Ν. ΔΩΔΕΚΑΝΗΣΟΥ,Δωδεκάνησα,ΝΟΜΟΣ ΔΩΔΕΚΑΝΗΣΟΥ,ΝΟΤΙΟΥ ΑΙΓΑΙΟΥ,Μ. Χωριό,85002,2246070893,2246070893,d.tilou@kep.gov.gr,
31,31,ΚΕΠ ΔΗΜΟΥ ΧΑΛΚΗΣ Ν. ΔΩΔΕΚΑΝΗΣΟΥ,ΧΑΛΚΗ ΔΩΔΕΚΑΝΗΣΟΥ,ΝΟΜΟΣ ΔΩΔΕΚΑΝΗΣΟΥ,ΝΟΤΙΟΥ ΑΙΓΑΙΟΥ,ΧΑΛΚΗ ΔΩΔΕΚΑΝΗΣΟΥ,85110,2246070900,2246070900,d.halkis@kep.gov.gr,
32,32,ΚΕΠ ΚΟΙΝΟΤΗΤΑΣ ΑΓΑΘΟΝΗΣΙΟΥ Ν. ΔΩΔΕΚΑΝΗΣΟΥ,,ΝΟΜΟΣ ΔΩΔΕΚΑΝΗΣΟΥ,ΝΟΤΙΟΥ ΑΙΓΑΙΟΥ,Αγαθονήσι,85001,2247029204,2247029204,k.agathonisiou@kep.gov.gr,
33,33,ΚΕΠ ΚΟΙΝΟΤΗΤΑ ΟΛΥΜΠΟΥ Ν. ΔΩΔΕΚΑΝΗΣΟΥ,ΟΛΥΜΠΟΣ ΚΑΡΠΑΘΟΥ,ΝΟΜΟΣ ΔΩΔΕΚΑΝΗΣΟΥ,ΝΟΤΙΟΥ ΑΙΓΑΙΟΥ,ΟΛΥΜΠΟΣ ΚΑΡΠΑΘΟΥ,85700,2245051055,2245051055,k.olympou@kep.gov.gr,
34,34,ΚΕΠ ΔΗΜΟΥ ΑΜΟΡΓΟΥ Ν. ΚΥΚΛΑΔΩΝ,Αμοργός,ΝΟΜΟΣ ΚΥΚΛΑΔΩΝ,ΝΟΤΙΟΥ ΑΙΓΑΙΟΥ,Χώρα Αμοργού,84008,2285074100,2285029307,d.amorgou@kep.gov.gr,
35,35,ΚΕΠ ΔΗΜΟΥ ΑΝΔΡΟΥ Ν. ΚΥΚΛΑΔΩΝ,ΧΩΡΑ Άνδρου Κυκλάδων,ΝΟΜΟΣ ΚΥΚΛΑΔΩΝ,ΝΟΤΙΟΥ ΑΙΓΑΙΟΥ,Χώρα ΑΝΔΡΟΥ,84500,2282029003,2282029002,d.androu@kep.gov.gr,
36,36,ΚΕΠ ΚΟΙΝΟΤΗΤΑ ΑΝΤΙΠΑΡΟΥ Ν. ΚΥΚΛΑΔΩΝ,Αντίπαρος Κυκλάδων,ΝΟΜΟΣ ΚΥΚΛΑΔΩΝ,ΝΟΤΙΟΥ ΑΙΓΑΙΟΥ,Αντίπαρος,84007,2284028314,2284028315,k.antiparou@kep.gov.gr,
37,37,ΚΕΠ ΔΗΜΟΥ ΑΝΩ ΣΥΡΟΥ Ν. ΚΥΚΛΑΔΩΝ,Σύρος Κυκλάδων,ΝΟΜΟΣ ΚΥΚΛΑΔΩΝ,ΝΟΤΙΟΥ ΑΙΓΑΙΟΥ,Εργατικές Κατοικίες-Μεσσαριά Πάγος,84100,2281079487,2281079487,d.anosyrou@kep.gov.gr,
38,38,ΚΕΠ ΔΗΜΟΥ ΔΡΥΜΑΛΙΑΣ Ν. ΚΥΚΛΑΔΩΝ,Νάξος Κυκλάδων,ΝΟΜΟΣ ΚΥΚΛΑΔΩΝ,ΝΟΤΙΟΥ ΑΙΓΑΙΟΥ,Φιλώτι Νάξος,84302,2285029315,2285029316,d.drymalias@kep.gov.gr,
39,39,ΚΕΠ ΔΗΜΟΥ ΕΞΩΜΒΟΥΡΓΟΥ Ν. ΚΥΚΛΑΔΩΝ,ΞΙΝΑΡΑ ΤHΝΟΥ,ΝΟΜΟΣ ΚΥΚΛΑΔΩΝ,ΝΟΤΙΟΥ ΑΙΓΑΙΟΥ,ΞΙΝΑΡΑ ΤHΝΟΥ,84200,2283051801,2283051802,d.exomvourgou@kep.gov.gr,
40,40,ΚΕΠ ΔΗΜΟΥ ΘΗΡΑΣ Ν. ΚΥΚΛΑΔΩΝ,Σαντορίνη,ΝΟΜΟΣ ΚΥΚΛΑΔΩΝ,ΝΟΤΙΟΥ ΑΙΓΑΙΟΥ,Φηρά,84700,2286027155,2286027156,d.thiras@kep.gov.gr,
41,41,ΚΕΠ ΚΟΙΝΟΤΗΤΑΣ ΟΙΑΣ ΜΕ ΕΝΑ ΠΑΡΑΡΤΗΜΑ Ν. ΚΥΚΛΑΔΩΝ,Οία Θήρας,ΝΟΜΟΣ ΚΥΚΛΑΔΩΝ,ΝΟΤΙΟΥ ΑΙΓΑΙΟΥ,Οία Θήρας,84702,2286071960,2286027161,k.oias@kep.gov.gr,
42,42,ΚΕΠ ΔΗΜΟΥ ΙΗΤΩΝ Ν. ΚΥΚΛΑΔΩΝ,Ίος Κυκλάδων,ΝΟΜΟΣ ΚΥΚΛΑΔΩΝ,ΝΟΤΙΟΥ ΑΙΓΑΙΟΥ,Ίος Κυκλάδες,84001,2286091937,2286091937,d.iiton@kep.gov.gr,
43,43,ΚΕΠ ΔΗΜΟΥ ΚΕΑΣ (ΙΟΥΛΙΔΟΣ) Ν. ΚΥΚΛΑΔΩΝ,Κέα,ΝΟΜΟΣ ΚΥΚΛΑΔΩΝ,ΝΟΤΙΟΥ ΑΙΓΑΙΟΥ,Ιουλίδα,84002,2288021150,2288021150,d.keas@kep.gov.gr,
44,44,ΚΕΠ ΔΗΜΟΥ ΚΟΡΘΙΟΥ Ν. ΚΥΚΛΑΔΩΝ,ΚΟΡΘΙ -ΑΝΔΡΟΣ,ΝΟΜΟΣ ΚΥΚΛΑΔΩΝ,ΝΟΤΙΟΥ ΑΙΓΑΙΟΥ,ΚΟΡΘΙ -ΑΝΔΡΟΣ,84502,2282061219,2282061419,d.korthiou@kep.gov.gr,
45,45,ΚΕΠ ΔΗΜΟΥ ΜΗΛΟΥ Ν. ΚΥΚΛΑΔΩΝ,Μήλος Κυκλάδων,ΝΟΜΟΣ ΚΥΚΛΑΔΩΝ,ΝΟΤΙΟΥ ΑΙΓΑΙΟΥ,Πλάκα,84800,2287022894,2287023374,d.milou@kep.gov.gr,
46,46,ΚΕΠ ΔΗΜΟΥ ΝΑΞΟΥ Ν. ΚΥΚΛΑΔΩΝ,Ερμούπολη,ΝΟΜΟΣ ΚΥΚΛΑΔΩΝ,ΝΟΤΙΟΥ ΑΙΓΑΙΟΥ,Νέο Δημαρχείο,84300,2285037130,2285029328,d.naxou@kep.gov.gr,
47,47,ΚΕΠ ΔΗΜΟΥ ΠΟΣΕΙΔΩΝΙΑΣ ΣΥΡΟΥ Ν. ΚΥΚΛΑΔΩΝ,ΒΑΡΗ,ΝΟΜΟΣ ΚΥΚΛΑΔΩΝ,ΝΟΤΙΟΥ ΑΙΓΑΙΟΥ,ΒΑΡΗ (ΠΡΩΗΝ ΚΟΙΝΟΤΙΚΟ ΓΡΑΦΕΙΟ),84100,2281079484,2281079485,d.poseidonias@kep.gov.gr,
48,48,ΚΕΠ ΔΗΜΟΥ ΣΕΡΙΦΟΥ Ν. ΚΥΚΛΑΔΩΝ,ΚΕΠ ΔΗΜΟΥ ΣΕΡΙΦΟΥ Ν. ΚΥΚΛΑΔΩΝ,ΝΟΜΟΣ ΚΥΚΛΑΔΩΝ,ΝΟΤΙΟΥ ΑΙΓΑΙΟΥ,Χώρα,84005,2281052545,2281052546,d.serifou@kep.gov.gr,
49,49,ΚΕΠ ΔΗΜΟΥ ΣΙΦΝΟΥ Ν. ΚΥΚΛΑΔΩΝ,-,ΝΟΜΟΣ ΚΥΚΛΑΔΩΝ,ΝΟΤΙΟΥ ΑΙΓΑΙΟΥ,Αρτεμώνας,84003,2284033880,2284033881,d.sifnou@kep.gov.gr,
50,50,ΚΕΠ ΔΗΜΟΥ ΤΗΝΟΥ Ν. ΚΥΚΛΑΔΩΝ,Τήνος Κυκλάδων,ΝΟΜΟΣ ΚΥΚΛΑΔΩΝ,ΝΟΤΙΟΥ ΑΙΓΑΙΟΥ,Ευαγγελιστρίας 38,84200,2283029146,2283029156,d.tinou@kep.gov.gr,
51,51,ΚΕΠ ΔΗΜΟΥ ΥΔΡΟΥΣΑΣ Ν. ΚΥΚΛΑΔΩΝ,"Παραλία Μπατσίου, Άνδρος",ΝΟΜΟΣ ΚΥΚΛΑΔΩΝ,ΝΟΤΙΟΥ ΑΙΓΑΙΟΥ,"Παραλία Μπατσίου, Άνδρος -",1,2282041848,2282029269,d.ydrousas@kep.gov.gr,
52,52,ΚΕΠ ΚΟΙΝΟΤΗΤΑ ΗΡΑΚΛΕΙΑΣ Ν. ΚΥΚΛΑΔΩΝ,Ηρακλειά,ΝΟΜΟΣ ΚΥΚΛΑΔΩΝ,ΝΟΤΙΟΥ ΑΙΓΑΙΟΥ,Ηρακλειά,84300,2285074183,2285071545,k.irakleias@kep.gov.gr,
53,53,ΚΕΠ ΔΗΜΟΥ ΕΡΜΟΥΠΟΛΕΩΣ Ν. ΚΥΚΛΑΔΩΝ,ΕΡΜΟΥΠΟΛΗ-ΣΥΡΟΣ,ΝΟΜΟΣ ΚΥΚΛΑΔΩΝ,ΝΟΤΙΟΥ ΑΙΓΑΙΟΥ,Ν. ΜΑΝΔΗΛΑΡΑ 31,84100,2281079643,2281079648,d.ermoupoleos@kep.gov.gr,
54,54,ΚΕΠ ΔΗΜΟΥ ΚΥΘΝΟΥ Ν. ΚΥΚΛΑΔΩΝ,ΚΥΘΝΟΣ,ΝΟΜΟΣ ΚΥΚΛΑΔΩΝ,ΝΟΤΙΟΥ ΑΙΓΑΙΟΥ,ΚΥΘΝΟΣ,84006,2281031640,2281031645,d.kithnou@kep.gov.gr,
55,55,ΚΕΠ ΔΗΜΟΥ ΚΑΛΥΜΝΙΩΝ Ν. ΔΩΔΕΚΑΝΗΣΟΥ,ΚΑΛΥΜΝΟΣ,ΝΟΜΟΣ ΔΩΔΕΚΑΝΗΣΟΥ,ΝΟΤΙΟΥ ΑΙΓΑΙΟΥ,ΠΑΝΑΓΙΑ ΧΩΡΑΣ,85200,2243029767,2243059024,d.kalymnion@kep.gov.gr,
56,56,ΚΕΠ ΔΗΜΟΥ ΚΩ Ν. ΔΩΔΕΚΑΝΗΣΟΥ,ΚΩΣ,ΝΟΜΟΣ ΔΩΔΕΚΑΝΗΣΟΥ,ΝΟΤΙΟΥ ΑΙΓΑΙΟΥ,ΑΚΤΗ ΚΟΥΝΤΟΥΡΙΩΤΗ 7,85300,2242025670,2242027190,d.ko@kep.gov.gr,
57,57,ΚΕΠ ΔΗΜΟΥ ΑΤΑΒΥΡΟΥ Ν. ΔΩΔΕΚΑΝΗΣΟΥ,ΕΜΠΩΝΑΣ ΡΟΔΟΥ,ΝΟΜΟΣ ΔΩΔΕΚΑΝΗΣΟΥ,ΝΟΤΙΟΥ ΑΙΓΑΙΟΥ,ΕΜΠΩΝΑΣ ΡΟΔΟΥ,1,2246041590,2246041572,d.attavirou@kep.gov.gr,
58,58,ΚΕΠ ΔΗΜΟΥ ΔΙΚΑΙΟΥ Ν. ΔΩΔΕΚΑΝΗΣΟΥ,ΠΥΛΙ ΚΩΣ,ΝΟΜΟΣ ΔΩΔΕΚΑΝΗΣΟΥ,ΝΟΤΙΟΥ ΑΙΓΑΙΟΥ,ΠΥΛΙ ΚΩΣ,85300,2242041821,2242041814,d.dikaiou@kep.gov.gr,
59,59,ΚΕΠ ΔΗΜΟΥ ΜΥΚΟΝΟΥ Ν. ΚΥΚΛΑΔΩΝ,ΧΩΡΑ ΜΥΚΟΝΟΥ,ΝΟΜΟΣ ΚΥΚΛΑΔΩΝ,ΝΟΤΙΟΥ ΑΙΓΑΙΟΥ,"ΛΙΜΝΗ, ΧΩΡΑ ΜΥΚΟΝΟΥ",84600,2289028621,2289028638,d.mykonou@kep.gov.gr,
60,60,ΚΕΠ ΔΗΜΟΥ ΠΑΡΟΥ Ν. ΚΥΚΛΑΔΩΝ,Παροικιά Πάρου,ΝΟΜΟΣ ΚΥΚΛΑΔΩΝ,ΝΟΤΙΟΥ ΑΙΓΑΙΟΥ,Δήμος Πάρου Παροικιά,84400,2284024912,2284024752,d.parou@kep.gov.gr,
61,61,ΚΕΠ ΚΟΙΝΟΤΗΤΑΣ ΑΝΑΦΗΣ Ν. ΚΥΚΛΑΔΩΝ,Ανάφη Κυκλάδων,ΝΟΜΟΣ ΚΥΚΛΑΔΩΝ,ΝΟΤΙΟΥ ΑΙΓΑΙΟΥ,Ανάφη Κυκλάδες,84009,2286061390,2286061396,k.anafis@kep.gov.gr,
62,62,ΚΕΠ ΚΟΙΝΟΤΗΤΑΣ ΔΟΝΟΥΣΑΣ Ν. ΚΥΚΛΑΔΩΝ,ΚΟΙΝΟΤΗΤΑΣ ΔΟΝΟΥΣΑΣ Ν. ΚΥΚΛΑΔΩΝ,ΝΟΜΟΣ ΚΥΚΛΑΔΩΝ,ΝΟΤΙΟΥ ΑΙΓΑΙΟΥ,ΔΟΝΟΥΣΑ,84300,2285029107,2285051639,k.donousis@kep.gov.gr,
63,63,ΚΕΠ ΚΟΙΝΟΤΗΤΑΣ ΚΙΜΩΛΟΥ Ν. ΚΥΚΛΑΔΩΝ,ΚΙΜΩΛΟΣ,ΝΟΜΟΣ ΚΥΚΛΑΔΩΝ,ΝΟΤΙΟΥ ΑΙΓΑΙΟΥ,ΚΙΜΩΛΟΣ -,84004,2287051230,2287051555,k.kimolou@kep.gov.gr,
64,64,ΚΕΠ ΚΟΙΝΟΤΗΤΑΣ ΚΟΥΦΟΝΗΣΙΩΝ Ν. ΚΥΚΛΑΔΩΝ,ΚΟΥΦΟΝΗΣΙΑ-ΚΥΚΛΑΔΕΣ,ΝΟΜΟΣ ΚΥΚΛΑΔΩΝ,ΝΟΤΙΟΥ ΑΙΓΑΙΟΥ,ΚΟΥΦΟΝΗΣΙΑ-ΚΥΚΛΑΔΕΣ,84300,2285029243,2285074188,k.koufonision@kep.gov.gr,
65,65,ΚΕΠ ΚΟΙΝΟΤΗΤΑΣ ΠΑΝΟΡΜΟΥ Ν. ΚΥΚΛΑΔΩΝ,-,ΝΟΜΟΣ ΚΥΚΛΑΔΩΝ,ΝΟΤΙΟΥ ΑΙΓΑΙΟΥ,Πύργος,84201,2283031302,2283031325,k.panormou@kep.gov.gr,
66,66,ΚΕΠ ΚΟΙΝΟΤΗΤΑΣ ΣΙΚΙΝΟΥ Ν. ΚΥΚΛΑΔΩΝ,"Σίκινος, Κυκλάδες",ΝΟΜΟΣ ΚΥΚΛΑΔΩΝ,ΝΟΤΙΟΥ ΑΙΓΑΙΟΥ,Σίκινος,84010,2286051196,2286051074,k.sikinou@kep.gov.gr,
67,67,ΚΕΠ ΚΟΙΝΟΤΗΤΑΣ ΣΧΟΙΝΟΥΣΣΑΣ Ν. ΚΥΚΛΑΔΩΝ,Σχοινούσα,ΝΟΜΟΣ ΚΥΚΛΑΔΩΝ,ΝΟΤΙΟΥ ΑΙΓΑΙΟΥ,Σχοινούσα -,84300,2285074250,2285074250,k.shoinoussis@kep.gov.gr,
68,68,ΚΕΠ ΚΟΙΝΟΤΗΤΑΣ ΦΟΛΕΓΑΝΔΡΟΥ Ν. ΚΥΚΛΑΔΩΝ,Φολέγανδρος,ΝΟΜΟΣ ΚΥΚΛΑΔΩΝ,ΝΟΤΙΟΥ ΑΙΓΑΙΟΥ,Φολέγανδρος,84011,2286027180,2286027170,k.folegandrou@kep.gov.gr,
69,69,ΚΕΠ ΔΗΜΟΥ ΑΓΙΑΣΟΥ Ν. ΛΕΣΒΟΥ,ΑΓΙΑΣΟΣ,ΝΟΜΟΣ ΛΕΣΒΟΥ,ΒΟΡΕΙΟΥ ΑΙΓΑΙΟΥ,ΑΓΙΑΣΟΣ,81101,2252023200,2252023200,d.agiasou@kep.gov.gr,
70,70,ΚΕΠ ΔΗΜΟΥ ΑΓ ΠΑΡΑΣΚΕΥΗΣ Ν. ΛΕΣΒΟΥ,ΑΓΙΑ ΠΑΡΑΣΚΕΥΗ ΛΕΣΒΟΥ,ΝΟΜΟΣ ΛΕΣΒΟΥ,ΒΟΡΕΙΟΥ ΑΙΓΑΙΟΥ,ΑΓΙΑ ΠΑΡΑΣΚΕΥΗ ΛΕΣΒΟΥ -,81102,2253350508 2253350500,2253350509,d.agparaskevis-lesvou@kep.gov.gr,
71,71,ΚΕΠ ΔΗΜΟΥ ΓΕΡΑΣ Ν. ΛΕΣΒΟΥ,Παπάδος Λέσβου,ΝΟΜΟΣ ΛΕΣΒΟΥ,ΒΟΡΕΙΟΥ ΑΙΓΑΙΟΥ,Παπάδος Γέρας Λέσβου,81106,2251084561,2251084626,d.geras@kep.gov.gr,
72,72,ΚΕΠ ΔΗΜΟΥ ΕΡΕΣΟΥ - ΑΝΤΙΣΣΗΣ ΜΕ ΕΝΑ ΠΑΡΑΡΤΗΜΑ Ν. ΛΕΣΒΟΥ,Ερεσός Λέσβου,ΝΟΜΟΣ ΛΕΣΒΟΥ,ΒΟΡΕΙΟΥ ΑΙΓΑΙΟΥ,Ερεσσός Λέσβου,81105,2253053600,2253052066,d.eresou@kep.gov.gr,
73,73,ΚΕΠ ΔΗΜΟΥ ΕΥΕΡΓΕΤΟΥΛΑ Ν. ΛΕΣΒΟΥ,"Συκούντα, Αγιάσος",ΝΟΜΟΣ ΛΕΣΒΟΥ,ΒΟΡΕΙΟΥ ΑΙΓΑΙΟΥ,"Συκούντα, Αγιάσος",81101,2251093045,2251093045,d.evergetoula@kep.gov.gr,
74,74,ΚΕΠ ΔΗΜΟΥ ΚΑΛΛΟΝΗΣ Ν. ΛΕΣΒΟΥ,Καλλονή Λέσβου,ΝΟΜΟΣ ΛΕΣΒΟΥ,ΒΟΡΕΙΟΥ ΑΙΓΑΙΟΥ,ΚΕΠ Καλλονής Λέσβου,81107,2253029930,2253029929,d.kallonis@kep.gov.gr,
75,75,ΚΕΠ ΔΗΜΟΥ ΜΑΝΤΑΜΑΔΟΥ Ν. ΛΕΣΒΟΥ,,ΝΟΜΟΣ ΛΕΣΒΟΥ,ΒΟΡΕΙΟΥ ΑΙΓΑΙΟΥ,Μανταμάδος,81104,2253061201,2253061201,d.mantamadou@kep.gov.gr,
76,76,ΚΕΠ ΔΗΜΟΥ ΠΕΤΡΑΣ Ν. ΛΕΣΒΟΥ,Πέτρα Λέσβου,ΝΟΜΟΣ ΛΕΣΒΟΥ,ΒΟΡΕΙΟΥ ΑΙΓΑΙΟΥ,Πέτρα Λέσβου,81109,2253042210,2253041235,d.petras-lesvou@kep.gov.gr,
77,77,ΚΕΠ ΔΗΜΟΥ ΠΛΩΜΑΡΙΟΥ Ν. ΛΕΣΒΟΥ,Πλωμάρι,ΝΟΜΟΣ ΛΕΣΒΟΥ,ΒΟΡΕΙΟΥ ΑΙΓΑΙΟΥ,Πλ. Βενιανίμ Λεσβίου -,81200,2252033740,2252033019,d.plomariou@kep.gov.gr,
78,78,ΚΕΠ ΔΗΜΟΥ ΠΟΛΙΧΝΙΤΟΥ Ν. ΛΕΣΒΟΥ,ΠΟΛΙΧΝΙΤΟΣ ΛΕΣΒΟΣ,ΝΟΜΟΣ ΛΕΣΒΟΥ,ΒΟΡΕΙΟΥ ΑΙΓΑΙΟΥ,Κ. Δεληγιάννη 22,81300,2252041212 2252042800,2252042800,d.polihnitou@kep.gov.gr,
79,79,ΚΕΠ ΔΗΜΟΥ ΜΥΡΙΝΑΣ Ν. ΛΕΣΒΟΥ,Μύρινα - Λήμνος,ΝΟΜΟΣ ΛΕΣΒΟΥ,ΒΟΡΕΙΟΥ ΑΙΓΑΙΟΥ,Αρβανιτάκη 20,81400,2254026020,2254024987,d.myrinas@kep.gov.gr,
80,80,ΚΕΠ ΔΗΜΟΥ ΜΟΥΔΡΟΥ Ν. ΛΕΣΒΟΥ,Κοντοπούλι-Λήμνου,ΝΟΜΟΣ ΛΕΣΒΟΥ,ΒΟΡΕΙΟΥ ΑΙΓΑΙΟΥ,Κοντοπούλι Λήμνου,81401,2254041278,2254041078,d.moudrou@kep.gov.gr,
81,81,ΚΕΠ ΔΗΜΟΥ ΝΕΑΣ ΚΟΥΤΑΛΗΣ Ν. ΛΕΣΒΟΥ,Κουτιάς Λήμνου,ΝΟΜΟΣ ΛΕΣΒΟΥ,ΒΟΡΕΙΟΥ ΑΙΓΑΙΟΥ,Κουτιάς Λήμνου,81400,2254051899,2254051899,d.neaskoutalis@kep.gov.gr,
82,82,ΚΕΠ ΔΗΜΟΥ ΑΤΣΙΚΗΣ Ν. ΛΕΣΒΟΥ,Λήμνος,ΝΟΜΟΣ ΛΕΣΒΟΥ,ΒΟΡΕΙΟΥ ΑΙΓΑΙΟΥ,Ατσική Λήμνου,81401,2254031780,2254031780,d.atsikis@kep.gov.gr,
83,83,ΚΕΠ ΚΟΙΝΟΤΗΤΑΣ ΑΓΙΟΥ ΕΥΣΤΡΑΤΙΟΥ ΝΟΜΟΥ ΛΕΣΒΟΥ,Άγιος Ευστράτιος Ν. Λέσβου,ΝΟΜΟΣ ΛΕΣΒΟΥ,ΒΟΡΕΙΟΥ ΑΙΓΑΙΟΥ,Άγιος Ευστράτιος,81500,2254093462,2254093462,k.ageystratiou@kep.gov.gr,
84,84,ΚΕΠ ΔΗΜΟΥ ΛΟΥΤΡΟΠΟΛΕΩΣ ΘΕΡΜΗΣ Ν. ΛΕΣΒΟΥ,ΛΟΥΤΡΟΠΟΛΗ ΘΕΡΜΗΣ,ΝΟΜΟΣ ΛΕΣΒΟΥ,ΒΟΡΕΙΟΥ ΑΙΓΑΙΟΥ,ΛΟΥΤΡΟΠΟΛΗ ΘΕΡΜΗΣ,81100,2251071200,2251071122,d.loutropoleos@kep.gov.gr,
85,85,ΚΕΠ ΔΗΜΟΥ ΜΗΘΥΜΝΗΣ Ν. ΛΕΣΒΟΥ,ΜΗΘΥΜΝΑ-ΛΕΣΒΟΥ,ΝΟΜΟΣ ΛΕΣΒΟΥ,ΒΟΡΕΙΟΥ ΑΙΓΑΙΟΥ,ΜΗΘΥΜΝΑ-ΛΕΣΒΟΥ,81108,2253072474,2253072475,d.mithimnas@kep.gov.gr,
86,86,ΚΕΠ ΔΗΜΟΥ ΙΩΝΙΑΣ Ν. ΧΙΟΥ,Χίος,ΝΟΜΟΣ ΧΙΟΥ,ΒΟΡΕΙΟΥ ΑΙΓΑΙΟΥ,Καλλιμασιά -,82100,2271351526 2271351527 2271351528,2271351525,d.ionias@kep.gov.gr,
87,87,ΚΕΠ ΔΗΜΟΥ ΑΓ ΜΗΝΑ Ν. ΧΙΟΥ,ΘΥΜΙΑΝΑ,ΝΟΜΟΣ ΧΙΟΥ,ΒΟΡΕΙΟΥ ΑΙΓΑΙΟΥ,,82100,2271032778,-,d.agmina@kep.gov.gr,
88,88,ΚΕΠ ΔΗΜΟΥ ΟΜΗΡΟΥΠΟΛΗΣ Ν. ΧΙΟΥ,Χίος Χίος,ΝΟΜΟΣ ΧΙΟΥ,ΒΟΡΕΙΟΥ ΑΙΓΑΙΟΥ,Παναγία Ερυθιανή,82200,2271093144,2271093190,d.omiroupolis@kep.gov.gr,
89,89,ΚΕΠ ΔΗΜΟΥ ΜΑΣΤΙΧΟΧΩΡΙΩΝ Ν. ΧΙΟΥ,Δήμος Μαστιχοχωρίων,ΝΟΜΟΣ ΧΙΟΥ,ΒΟΡΕΙΟΥ ΑΙΓΑΙΟΥ,Πυργί -,82102,2271072893,2271072893,d.mastihohorion@kep.gov.gr,
90,90,ΚΕΠ ΔΗΜΟΥ ΟΙΝΟΥΣΣΩΝ Ν. ΧΙΟΥ,Οινούσσες Χίου,ΝΟΜΟΣ ΧΙΟΥ,ΒΟΡΕΙΟΥ ΑΙΓΑΙΟΥ,Οινούσσες Χίου,82101,2271055723,2271055723,d.oinousson@kep.gov.gr,
91,91,ΚΕΠ ΔΗΜΟΥ ΚΑΜΠΟΧΩΡΩΝ Ν. ΧΙΟΥ,Δημος Καμποχώρων Λέσβου,ΝΟΜΟΣ ΧΙΟΥ,ΒΟΡΕΙΟΥ ΑΙΓΑΙΟΥ,Δημαρχείο Καμποχώρων Χαλκείος -,82100,2271351614 2271351623 2271351622,2271078765,d.kampohoron@kep.gov.gr,
92,92,ΚΕΠ ΔΗΜΟΥ ΨΑΡΩΝ Ν. ΧΙΟΥ,Ψαρά Νομού Χίου,ΝΟΜΟΣ ΧΙΟΥ,ΒΟΡΕΙΟΥ ΑΙΓΑΙΟΥ,Ψαρά,82104,2274061342,2274061341,d.psaron@kep.gov.gr,
93,93,ΚΕΠ ΔΗΜΟΥ ΑΜΑΝΗΣ Ν. ΧΙΟΥ,Χίος,ΝΟΜΟΣ ΧΙΟΥ,ΒΟΡΕΙΟΥ ΑΙΓΑΙΟΥ,Βολισσός,82103,2274022000,2274022000,d.amanis@kep.gov.gr,
94,94,ΚΕΠ ΔΗΜΟΥ ΚΑΡΛΟΒΑΣΙΩΝ Ν. ΣΑΜΟΥ,Καρλόβασι Σάμου,ΝΟΜΟΣ ΣΑΜΟΥ,ΒΟΡΕΙΟΥ ΑΙΓΑΙΟΥ,Νέο Καρλόβασι -,83200,2273350813 2273350814,2273350840,d.karlovasion@kep.gov.gr,
95,95,ΚΕΠ ΔΗΜΟΥ ΑΓ ΚΗΡΥΚΟΥ Ν. ΣΑΜΟΥ,ΑΓΙΟΣ ΚΗΡΥΚΟΣ,ΝΟΜΟΣ ΣΑΜΟΥ,ΒΟΡΕΙΟΥ ΑΙΓΑΙΟΥ,ΑΓΙΟΣ ΚΗΡΥΚΟΣ -,83300,2275350421 2275350422,2275022202,d.agkirikou@kep.gov.gr,
96,96,ΚΕΠ ΔΗΜΟΥ ΚΑΡΔΑΜΥΛΩΝ Ν. ΧΙΟΥ,ΜΑΡΜΑΡΟ ΚΑΡΔΑΜΥΛΩΝ,ΝΟΜΟΣ ΧΙΟΥ,ΒΟΡΕΙΟΥ ΑΙΓΑΙΟΥ,ΜΑΡΜΑΡΟ ΚΑΡΔΑΜΥΛΩΝ,82300,2272081060,2272081060,d.kardamilon@kep.gov.gr,
97,97,ΚΕΠ ΔΗΜΟΥ ΕΥΔΗΛΟΥ Ν. ΣΑΜΟΥ,Εύδηλος Ικαρίας,ΝΟΜΟΣ ΣΑΜΟΥ,ΒΟΡΕΙΟΥ ΑΙΓΑΙΟΥ,Εύδηλος Ικαρίας,83302,2275032994,2275032995,d.evdilou@kep.gov.gr,
98,98,ΚΕΠ ΔΗΜΟΥ ΡΑΧΩΝ Ν. ΣΑΜΟΥ,Ράχες Ικαρίας,ΝΟΜΟΣ ΣΑΜΟΥ,ΒΟΡΕΙΟΥ ΑΙΓΑΙΟΥ,Χριστός Ραχών Ικαρίας,83301,2275041611,2275041464,d.rahon@kep.gov.gr,
99,99,ΚΕΠ ΔΗΜΟΥ ΠΥΘΑΓΟΡΕΙΟΥ Ν. ΣΑΜΟΥ,ΔΗΜΟΤΙΚΟ ΚΤΙΡΙΟ ΧΩΡΑΣ Δ/Δ ΧΩΡΑΣ ΣΑΜΟΥ,ΝΟΜΟΣ ΣΑΜΟΥ,ΒΟΡΕΙΟΥ ΑΙΓΑΙΟΥ,ΔΗΜΟΤΙΚΟ ΚΤΙΡΙΟ ΧΩΡΑΣ Δ/Δ ΧΩΡΑΣ ΣΑΜΟΥ Τ.Θ. 87,83103,2273091784,2273091783,d.pythagoreiou@kep.gov.gr,
100,100,ΚΕΠ ΔΗΜΟΥ ΜΑΡΑΘΟΚΑΜΠΟΥ Ν. ΣΑΜΟΥ,Μαραθόκαμπος,ΝΟΜΟΣ ΣΑΜΟΥ,ΒΟΡΕΙΟΥ ΑΙΓΑΙΟΥ,Μαραθόκαμπος -,83102,2273037500,2273037500,d.marathokampou@kep.gov.gr,
101,101,ΚΕΠ ΔΗΜΟΥ ΦΟΥΡΝΩΝ ΚΟΡΣΕΩΝ Ν. ΣΑΜΟΥ,Νήσος Φούρνοι,ΝΟΜΟΣ ΣΑΜΟΥ,ΒΟΡΕΙΟΥ ΑΙΓΑΙΟΥ,Φούρνοι Κορσέων -,83400,2275350614 2275350615 2275350616 2275051234,2275350617,d.fournon@kep.gov.gr,
102,102,ΚΕΠ ΔΗΜΟΥ ΧΙΟΥ Ν. ΧΙΟΥ,ΧΙΟΣ,ΝΟΜΟΣ ΧΙΟΥ,ΒΟΡΕΙΟΥ ΑΙΓΑΙΟΥ,ΔΗΜΟΚΡΑΤΙΑΣ 2,82100,2271081101,2271081102,d.hiou@kep.gov.gr,
103,103,ΚΕΠ ΔΗΜΟΥ ΒΑΘΕΟΣ Ν. ΣΑΜΟΥ,ΒΑΘΥ,ΝΟΜΟΣ ΣΑΜΟΥ,ΒΟΡΕΙΟΥ ΑΙΓΑΙΟΥ,ΠΛΑΤΕΙΑ ΑΓ. ΣΠΥΡΙΔΩΝΟΣ -,83100,2273350133 2273350132,2273089850,d.vatheos@kep.gov.gr,
104,104,ΚΕΠ ΔΗΜΟΥ ΜΥΤΙΛΗΝΗΣ Ν. ΛΕΣΒΟΥ,ΜΥΤΙΛΗΝΗ,ΝΟΜΟΣ ΛΕΣΒΟΥ,ΒΟΡΕΙΟΥ ΑΙΓΑΙΟΥ,ΚΩΝΣΤΑΝΤΙΝΟΥΠΟΛΕΩΣ 3,81100,2251037625,2251029026,d.mytilinis@kep.gov.gr,
105,105,ΚΕΠ ΕΠΑΡΧΕΙΟΥ ΚΑΛΥΜΝΟΥ Ν. ΔΩΔΕΚΑΝΗΣΟΥ,ΕΠΑΡΧΕΙΟ ΚΑΛΥΜΝΟΥ ΠΑΛΑΙΟ ΔΙΟΙΚΗΤΗΡΙΟ,ΝΟΜΟΣ ΔΩΔΕΚΑΝΗΣΟΥ,ΝΟΤΙΟΥ ΑΙΓΑΙΟΥ,ΕΠΑΡΧΕΙΟ ΚΑΛΥΜΝΟΥ ΠΑΛΑΙΟ ΔΙΟΙΚΗΤΗΡΙΟ -,85200,2243059643 2243059644,2243029100,e.kalumnou@kep.gov.gr,
106,106,ΚΕΠ ΕΠΑΡΧΕΙΟΥ ΚΩ Ν. ΔΩΔΕΚΑΝΗΣΟΥ,ΔΙΟΙΚΗΤΗΡΙΟ,ΝΟΜΟΣ ΔΩΔΕΚΑΝΗΣΟΥ,ΝΟΤΙΟΥ ΑΙΓΑΙΟΥ,ΑΚΤΗ ΜΙΑΟΥΛΗ-ΔΙΟΙΚΗΤΗΡΙΟ 2,85300,2242049258,2242049260,e.ko@kep.gov.gr,
107,108,ΚΕΠ ΕΠΑΡΧΕΙΟΥ ΛΗΜΝΟΥ Ν. ΛΕΣΒΟΥ,ΜΥΡΙΝΑ-ΛΗΜΝΟΥ,ΝΟΜΟΣ ΛΕΣΒΟΥ,ΒΟΡΕΙΟΥ ΑΙΓΑΙΟΥ,ΜΥΡΙΝΑ-ΛΗΜΝΟΥ -,81400,2254029110,2254023620,e.limnou@kep.gov.gr,
108,109,ΚΕΠ ΕΠΑΡΧΕΙΟΥ ΙΚΑΡΙΑΣ Ν. ΣΑΜΟΥ,ΕΠΑΡΧΕΙΟ ΙΚΑΡΙΑΣ ΣΑΜΟΥ,ΝΟΜΟΣ ΣΑΜΟΥ,ΒΟΡΕΙΟΥ ΑΙΓΑΙΟΥ,ΕΠΑΡΧΕΙΟ ΙΚΑΡΙΑΣ ΣΑΜΟΥ,83300,2275024023,2275024023,e.ikarias@kep.gov.gr,
109,115,ΚΕΠ ΕΠΑΡΧΕΙΟΥ ΠΑΡΟΥ Ν. ΚΥΚΛΑΔΩΝ,ΠΑΡΟΙΚΙΑ-ΠΑΡΟΣ,ΝΟΜΟΣ ΚΥΚΛΑΔΩΝ,ΝΟΤΙΟΥ ΑΙΓΑΙΟΥ,ΠΑΡΟΙΚΙΑ-ΠΑΡΟΣ,84400,2284024750,2284024751,e.parou@kep.gov.gr,
110,116,ΚΕΠ ΕΠΑΡΧΕΙΟΥ ΝΑΞΟΥ Ν. ΚΥΚΛΑΔΩΝ,ΧΩΡΑ ΝΑΞΟΥ,ΝΟΜΟΣ ΚΥΚΛΑΔΩΝ,ΝΟΤΙΟΥ ΑΙΓΑΙΟΥ,ΚΑΖΑΝΑΚΙΑ,84300,2285024303,2285026103,e.naxou@kep.gov.gr,
111,117,ΚΕΠ ΔΗΜΟΥ Ν ΕΡΥΘΡΑΙΑΣ Ν. ΑΤΤΙΚΗΣ,Νέα Ερυθραία Αττική,ΝΟΜΑΡΧΙΑΚΟ ΔΙΑΜΕΡΙΣΜΑ ΑΘΗΝΩΝ-ΑΝΑΤΟΛΙΚΟΣ ΤΟΜΕΑΣ,ΑΤΤΙΚΗΣ,Ηρώων Πολυτεχνείου 26,14671,2106255980,2106255983,d.neaserythraias@kep.gov.gr,
